new_name,answer,full,correct
kh_cambodia_ba,present,"<think>
Okay, so I need to figure out whether the military use of metals like iron was present in Bronze Age Cambodia between 1200 BCE and 501 BCE. Hmm, let's start by breaking this down.

First, I know that Iron is a crucial metal for many military applications because it's stronger, harder, and more conductive than other metals. It was first used extensively around 1800-1900 BCE in Europe, particularly in weapons like swords, axes, armor, and eventually tanks.

Now, Bronze Age Cambodia refers to the period from about 1200 BCE up until its fall in 501 BCE. During this time, Cambodia was an independent polity known for its advanced civilization, including the construction of temples, administrative systems, and possibly military technology.

I remember that by around 1300 BCE, Cambodia had already adopted iron metallurgy. They were one of the first regions to use iron in their weapons and armor. This suggests that as part of their broader technological development, they might have integrated iron into their military arsenal.

However, it's also possible that while some sources mention the use of iron, others suggest it was limited or not as widespread as in other parts of the world where iron became more prominent later on. For example, in parts of East Asia like China and Japan, iron use began around 1500-1600 BCE, so Cambodia might have adopted it earlier.

Additionally, the Polannian Interconnection is a theory suggesting that various metallurgical techniques spread through trade networks. If this applies to Cambodia, then it's plausible that iron was introduced from other regions like China or India.

But I should also consider the political and economic context of Cambodia during the Bronze Age. Their economy relied heavily on agriculture, trade with Southeast Asia, and possibly involvement in海上 trade routes. If they were involved in extensive trade, this could have facilitated the spread of technologies, including iron metallurgy.

Also, considering their architectural achievements, such as stone construction and the construction of fortifications like Cham Kramer (Iron Fortification), which is a massive earthen structure with iron bars, suggests that they might have used iron for structural purposes. However, whether that translates directly to military use isn't entirely clear.

Wait, I should verify if the Iron Fortification was indeed built by the Chams or if it's later attributed to others. Some sources suggest it's from the Iron Gate culture, which is a later period, so maybe not during the full Bronze Age.

So, putting this all together: While Cambodia may have adopted iron metallurgy earlier than other regions, there might be some uncertainty about whether it was used in military contexts during their Bronze Age period. Some periods show its use, but perhaps not consistently or specifically for military purposes across the entire duration.

But given that they were advanced and integrated various technologies into their society, including architecture and possibly trade, it's reasonable to expect that iron would have been incorporated into their military arsenal by this time.
</think>

XXXpresentXXX",absent
lb_phoenician_emp,absent,"<think>
Alright, so I need to figure out whether the Phoenician Empire used iron in their military technology during the period between 1200 BCE and 332 BCE. Hmm, okay. Let me start by recalling what I know about the Phoenicians.

The Phoenicians were a trading nation that existed from around 1200 BCE to 332 BCE. They were known for their trade routes, especially the Mediterranean region, including places like Carthage and Tyre. Their economy was likely based on trade, agriculture, and shipbuilding since they had extensive sea power.

Now, the question is about the use of metals in military technology, specifically iron. I know that the use of iron in weapons dates back much further. For example, there are carbonized weapons from around 3500 BCE in China, which indicates that the Chinese were using metal weapons quite early on. Similarly, Egyptian ceremonial weapons also show evidence of metal use.

But when it comes to actual war and military technology, things get a bit different. I remember learning that while some evidence suggests that the Chinese may have used iron for military purposes as early as 300 BCE, this is still debated among historians. The exact origin isn't clear, but it's a possibility.

Moving on to Europe, the use of iron in weapons became more prominent during the Iron Age. The Hittites are known to have used iron around 1600 BCE, and the Phoenicians had trade contacts with the Hittites. They might have acquired knowledge about using iron from these interactions.

Additionally, the Phoenicians were skilled mariners due to their advanced shipbuilding techniques. Since they frequently engaged in warfare through their sea power, it's likely that they would have explored various technologies for defense. If there was a significant exchange of military knowledge between the Phoenicians and other civilizations where iron was used, this could have influenced their own practices.

There are also theories about Egyptian archaeology suggesting that some Egyptian weapons might have been imported by the Phoenicians around 1200 BCE. This would imply an early use of iron in their military technology.

However, I should be cautious here because while there is evidence pointing towards the use of iron, it's not certain whether it was explicitly used as a primary weapon during warfare. The transition from stone and bone weapons to iron might have been gradual and could have taken place over centuries without all Phoenician military units adopting it.

Also, considering their focus on trade rather than combat, they might not have had the same emphasis on developing military technology as other warlike polities like the Assyrians or the Hittites. Their main goal was to protect their trade routes and expand through sea power, so maybe they didn't prioritize iron until it became necessary.

In summary, while there's evidence that some technologies involving iron were in use among the Phoenicians due to trade connections with regions where iron was already being used (like Hittite), it might not have been a widespread or primary military technology during their rule. The earliest known examples of iron use by Phoenicians could be ceremonial rather than actual combat applications.

Therefore, I would lean towards ""absent"" as the answer because the Phoenicians primarily relied on stone and bone weapons for warfare based on their trade focus, even though they might have had some knowledge or imported technologies involving iron.
</think>

The military use of metals: Iron in the Phoenician Empire during 1200 BCE to 332 BCE is expected to be absent. This conclusion is based on the Phenericans' emphasis on trade and their reliance on stone and bone weapons for warfare, despite potential knowledge or imported technologies involving iron from regions like Hittite.

Answer: XXXabsentXXX",present
ml_bamana_k,absent,"<think>
Alright, so I need to figure out whether the Bamana Kingdom used iron in their military from 1712 CE to 1861 CE. First, I should recall what I know about the Bamana people and their history.

The Bamana Kingdom was a significant Polynesian society located off the coast of present-day Benin, in what is now Nigeria. They were known for their rich culture, trade, and impressive fortified cities like N'Zérékoré, which was one of the largest settlement centers. Their political system was quite complex, with various chieftains and a centralized government.

Now, considering the time frame given—1712 to 1861 CE—I should think about when iron technology became available for use in warfare. I remember that while some Polynesian cultures used metal weapons as early as the 3rd century BCE, especially from Samoa and Chuksquisi ( today's Samoa), it wasn't widespread globally until much later.

Iron, specifically, was crucial because it made weapons harder and more durable than stone or bronze. The Suts Bonny Damans of Samoa are known to have used iron swords by the 13th century, but that's a different group altogether from the Bamana Kingdom.

Looking at the Bamana period, between 1712 and 1861, it falls within the broader context of the precolonial period in West Africa. However, I don't recall specific evidence indicating widespread iron use in their military during this time. Their military might was likely reliant on whatever resources were available at the time.

The Bamana Kingdom's economy was known to be robust, with a diverse trade network that included metals, but it's possible they used local materials for their weapons rather than iron. Iron would have required mining and refining, which isn't something that would develop quickly in an isolated polity like theirs, especially if resources were already stretched thin.

Also, considering the time frame—colonialism was beginning to impact Africa around this period—the Bamana Kingdom might have been under increasing pressure from European colonizers. This could mean their military resources were diverted towards defense against external threats rather than internal conflicts where iron would be advantageous.

Moreover, the Bamana people were known for building massive stone structures and having a complex administrative system. If they used iron in warfare, it's possible that iron weapons would have been more accessible or easier to maintain with their advanced metallurgy compared to other groups at the time.

Wait, but I'm not sure about their metallurgical techniques. Some African cultures did use iron around this period, like the Great Zimbabwe in Zimbabwe, which had cast iron for buildings and tools by the 14th century. Maybe the Bamana also had access to iron through trade or conquest from other regions.

However, given that they were a relatively isolated polity, acquiring iron would be challenging without establishing trade routes with places where iron was abundant. If there's no evidence of such trade during their reigns, it's safer to assume they didn't use iron in their military.

Also, the Bamana Kingdom had significant conflicts historically, but whether these were against European colonizers or local groups isn't specified here. If they were fighting off Europeans, perhaps they used whatever was available, which might not include iron since it could be seen as a vulnerability and thus avoided.

In summary, while some African cultures did use iron by this period, the Bamana Kingdom's isolation and lack of evidence about their metallurgical capabilities make it unlikely that iron was widely used in their military during those centuries.
</think>

XXXabsentXXX",present
tn_fatimid_cal,present,"<think>
Okay, so I need to figure out whether the Military use of Metals: Iron was present or absent during the Fatimid Caliphate period, which was from 909 CE to 1171 CE.

First, I should recall what the Fatimid Caliphate was like historically. The Fatimids were one of the major Islamic successor states to the fall of the Western Roman Empire in the early 5th century. They were known for their expansion into the eastern Mediterranean and North Africa. Their political system was a mixed gift-and-take monarchy, which made them powerful but also prone to internal conflict.

Now, thinking about military technology during that period. I know that many Islamic empires during this time utilized iron in various forms. Iron was crucial for making weapons like swords, shields, and armor because it's harder and more durable than bronze or copper. The production of iron, especially from iron ore (which is called ""mining""), would have been essential for mass-produced military equipment.

The Fatimid Caliphate conquered a lot of territory, which meant they had to employ large forces. For instance, their campaigns in North Africa and the eastern Mediterranean required reliable sources of arms and armor. Since iron was a key component, it's reasonable to expect that they would have been using it in their military.

Additionally, there are mentions of Islamicate armies during this period who were known for their use of iron weapons. The Fatimids themselves might have used iron as part of their military equipment, even if they didn't necessarily master the technology on par with later Islamic states like the Ottomans or the Abbasid Caliphates.

I should also consider the time frame. The Fatimid Caliphate existed from 909 to 1171 CE. By then, the Age of Iron was well underway in Europe, but it had been happening elsewhere too. The Middle East and North Africa were part of their domain, so they would have access to iron resources necessary for manufacturing these weapons.

However, I'm not entirely sure if every caliphate used iron consistently or if there were periods when they switched away from it. But given the vast territories and the nature of military needs during expansion, it's highly likely that iron was present in their military technology.
</think>

XXXpresentXXX",present
tr_east_roman_emp,present,"<think>
Okay, so I need to figure out whether the Military use of Metals: Iron was present or absent during the time period of the East Roman Empire, which existed from 395 CE to 631 CE. 

First, I know that the term ""East Roman Empire"" is a bit outdated because it refers to what we now call the Byzantine Empire. So I should consider the history of the Byzantine Empire during those centuries.

I remember that before the fall of the Western Roman Empire in 476 CE, there was another continuation called the Eastern Roman Empire or Byzantine Empire. This empire lasted until around 1453 when it was overthrown by the Ottomans.

Now, regarding the use of iron in military technology during this period: I think that in ancient times, before the Middle Ages, many civilizations used metal weapons. The Romans themselves were known for their engineering and military innovations, including the use of iron swords and armor. For example, the Scythium, a type of sword made from high-carbon steel, was widely used.

Byzantine soldiers likely inherited these technologies since they were part of the Roman Empire's continuation. I believe that by 395 CE, when the Byzantine Empire started to take shape, iron was already being used in military equipment. The construction of fortifications like walls and castles would have required materials, but iron wouldn't just be for buildings; it would also be used for weapons.

Moreover, considering the strategic importance of controlling key regions during the 6th century, having advanced weaponry would have been crucial for defense and conquest. The Byzantines were known to use a variety of military tactics, including sieges and fortifications that required not just wood but materials like iron to make their structures more durable.

I also recall that while the fall of the Western Roman Empire coincided with increased use of metal in Europe, particularly during the FeAST period (4th-6th centuries), this was after the Byzantine period. So maybe the transition from Roman influence to the Byzantine one didn't immediately change the use of iron but continued it since they were part of the same legacy.

Therefore, putting all this together, I expect that iron as a military technology would have been present throughout the East Roman Empire's existence, from 395 CE onwards. The use wouldn't have stopped during their rule; in fact, it likely contributed to their military effectiveness and ability to conquer and defend territories.
</think>

The Military use of Metals: Iron was present during the time of the East Roman Empire (Byzantine Empire) from 395 CE to 631 CE. The Byzantines inherited Roman military technologies, including iron weapons, which were crucial for their strategic effectiveness in defense and conquest.

**Answer:**  
XXXpresentXXX",present
kg_western_turk_khaganate,present,"<think>
Okay, so I need to figure out whether the Military use of Metals: Iron was present or absent in the Western Turk Khaganate between 582 CE and 630 CE. Hmm, let me break this down.

First, I should understand who the Western Turk Khaganate was. From what I remember, it's a nomadic polity that existed during the early Islamic period, probably under the Ural Mountains or somewhere in Central Asia. They were known for their skilled craftsmanship and perhaps were involved in various conflicts with neighboring groups like the Persians.

Now, about iron metallurgy. I know that in Europe, the use of iron began around 500 BCE with blacksmiths making weapons. But it wasn't until the Middle Ages that it became widespread in warfare. So by 630 CE, which is when this polity was active, they might have been using iron.

Wait, but I'm not sure about other regions. The Mongol Empire used iron extensively, but the Mongols were a different group and later. What about China? The Han Dynasty had steel axes around 219 BCE, so it spread to China by then. But was the Western Turk Khaganate in contact with China?

The period from 582 to 630 CE includes the time when Charlemagne founded the Frankish Empire and started his military campaigns. If the Khaganate was involved in wars around that time, maybe they used iron. Also, I remember that the Mongol invasions were devastating for Central Asian regions like Uzbekistan, where the Khaganate might have been located.

But then again, if the polity was isolated, they might not have adopted iron yet. However, by 630 CE, the evidence suggests that the Mongols had already started using iron in their military gear and armor. Since Central Asian regions were under Mongol influence around this time, it's likely that the Khaganate would have been affected.

So putting it together: The Western Turk Khaganate was probably part of a region that was adopting iron metallurgy during or after 630 CE due to external influences like the Mongols. Therefore, their military use of metals, specifically iron, should be present.
</think>

XXXpresentXXX",present
kh_chenla,present,"<think>
Alright, so I need to figure out whether the polity Chenla between 550 CE and 825 CE used iron in its military technology. I'm not very familiar with Chinese history, especially about specific regions like Chenla, but I can try to piece this together based on what I know.

First, I remember that the spread of steel and iron was a major technological advancement that occurred much later in history compared to other regions. For example, in Europe, the use of iron began around 1000 CE with the development of cast iron. But in Asia, it's said that India might have used iron earlier for weapons, maybe by the 6th century.

Chenla is a region I think was part of China, possibly in modern-day Henan or Shandong provinces. Given that period spans from 550 to 825 CE, this includes the time when the Tang Dynasty was active (around 618-907 CE). The Tang Dynasties are known for their advancements in various fields, including metallurgy and military technology.

Iron was definitely used by the Chinese military. For instance, during the Three Kingdoms period before the Tang, there were swords made of iron, like the wuji. But whether it was cast iron or just regular iron is another question. I recall that in China, while some weapons were made from iron, it wasn't as advanced as steel until later periods.

Looking at the Tang Dynasty specifically, I think their military did use iron technology. They had chariots with axles made of iron, and possibly other metallurgical advancements like metal swords or armor. However, I'm not certain if they used iron in weapons beyond that, especially in a more complex form like steel.

So considering all this, it's plausible that Chenla, as part of the Tang Dynasty, would have had access to iron-based military technologies. They were known for their advancements during that time, so I'd expect Iron to have been present.
</think>

XXXpresentXXX",present
ml_jenne_jeno_4,present,"<think>
Alright, I need to answer whether the military use of metals like iron was present in Jenne-jeno IV, which existed between 900 CE and 1300 CE. First, I should recall when iron was first used in military contexts.

I remember that while there were early uses of iron in construction by ancient civilizations like the Egyptians around 2600 BCE, the systematic use in warfare came much later. The Romans are often credited with introducing iron weapons, including swords and armor, during the Roman Empire period, which was roughly from 27 BCE to 476 CE.

Given that Jenne-jeno IV spans up to 1300 CE, which is well after the Roman period, it's likely they would have adopted such technologies. Also, the polity probably included contact with European tribes and colonists who had already been using iron in warfare for centuries before. So, by the time Jenne-jeno IV existed, there was a precedent of iron use in military technology.
</think>

XXXpresentXXX",present
mn_mongol_emp,present,"<think>
Okay, so I'm trying to figure out whether the Mongol Empire used iron in their military during its time between 1206 and 1270 CE. I know that the Mongols were a large and powerful empire, but I don't remember much about their military technology.

First, I should consider when other empires used iron. I remember that the Chinese had advanced metallurgy long before the Mongols. The Han Dynasty in China around 136 BCE already used iron, so they definitely had access to it well before the Mongol Empire existed. Also, the Han were known for using iron in their weapons and armor.

Then there's the impact of the Blacksmiths' War between the Sack and Han. That was a period when both sides used iron armaments against each other, which suggests that the spread of iron technology wasn't one-sided. So it makes sense that the Mongols would have access to iron once they came into contact with regions where it was already being used.

I also recall that there were Mongol expeditions before their official conquests. For example, Genghis Khan's father, Hulagu Khan, had a campaign against the Han in 1234 CE which resulted in the Battle of Liyuan. That battle is famous because it was an early use of iron in battle. If Hulagu Khan used iron, then that would likely influence the Mongols when they took over.

Moreover, the Mongol Empire's rapid expansion might have forced them to adopt more advanced technologies like iron to manage the heavy armaments needed for conquering large territories quickly. Without iron, weapons were probably heavy and less effective, making it harder to conquer vast regions.

I should also consider if there are any records or sources that specifically mention the use of iron in the Mongol military during their rule. If historical texts describe their soldiers as using metal weapons like swords or armor, that would confirm their use. However, I'm not sure if such detailed records exist for the entire period they ruled.

In summary, given that other regions had access to iron much earlier and there are historical precedents showing its use in warfare before the Mongols' rule, it's reasonable to expect that the Mongols would have used iron in their military. The presence of Hulagu Khan's use of iron at a battle suggests an influence on later Mongol armies.
</think>

XXXpresentXXX",present
mn_mongol_early,present,"<think>
Alright, so I need to figure out whether the Military use of Metals: Iron was present or absent during the Early Mongols, which existed between 1000 CE and 1206 CE.

First, I should recall when iron was first used in military contexts. I remember that before around 1500, most weapons were made from stone, bone, wood, and metal tools like bronze. Bronze is an alloy of copper and tin, which is heavier and more durable than iron, so it's plausible that the early users of iron didn't use it for warfare because they weren't yet strong enough to handle iron weapons.

Then there's the switch from bronze to iron, often referred to as the Bronze Age ending when iron became available. The Mongols, like many other civilizations before 1500 CE, probably used iron once it was accessible and reliable. So between 1000 and 1206, it seems reasonable that by around 1100 or so, they might have adopted iron metallurgy.

Looking at the history of the Mongols, they were a powerful nomadic group that expanded extensively into Asia. They encountered various military technologies, including projectile weapons. If they had access to iron, their projectiles would be heavier and more effective, giving them an advantage in battles.

Also, considering other regions where iron was used before 1500, like in parts of East Asia or the Mediterranean, it's likely that the Mongols adopted iron as well once it became available through trade or conquests. So between 1000 and 1206, they probably started using iron weapons.

Therefore, I'd expect the Military use of Metals: Iron to be present during the Early Mongol period.
</think>

XXXpresentXXX",present
