new_name,answer,full,correct
th_ayutthaya,present,"<think>
Okay, so I need to figure out whether there was a Drinking Water Supply System in the Ayutthaya polity between 1593 and 1767 CE based on historical knowledge. Hmm, I'm not super familiar with Ayutthaya, but I know it's a significant historical site connected with Thailand. Let me break this down.

First, what is the Ayutthaya? From what I remember, it's one of the largest khadsan or royal cities in Thailand. It was founded by King Rama IV (Rajabhat VI) in 1583 CE, right? And it lasted until 1767 CE when it was occupied and abandoned by the British during the Trail Blazers period. So that's within the timeframe given.

Now, the question is about whether there was a Drinking Water Supply System. That means I need to consider if the polity had access to reliable drinking water, either through specialized buildings or systems owned by the state or community.

I know that many ancient and medieval cities developed elaborate irrigation systems for their populations, but water supply as a system might be more complex. In many societies, especially in colder climates, having access to clean water is crucial. So, maybe Ayutthaya had such a system?

Looking into history, Thailand's early rulers often built infrastructure like reservoirs and canals. The Ayutthaya was a center of culture and administration, so it likely had resources allocated for its people's needs. By the time of Rama IV, they were already building extensive systems for water supply.

I recall that during the Khmer Empire in Cambodia, there were impressive engineering feats like reservoirs, but Ayutthaya is Thai. Thai architecture often emphasizes sustainability and community involvement, so a drinking water system could have been integrated into their urban planning.

Moreover, the city's layout probably had religious sites contributing to water usage since many temples require clean water for rituals. This might have influenced the development of a structured water supply system.

Also, considering that Ayutthaya was a major trade center in its time, having a reliable water supply would be essential not just for daily life but also for commerce and administration.

However, I'm not entirely sure if they had a centralized system with specialized buildings. Maybe it was more decentralized, using local sources like wells or rivers. Or perhaps it evolved over time as the city expanded.

I should also consider external factors, such as colonial influence. When the British took over in 1767, Ayutthaya became an important strategic point before being captured. Post-British, Thailand's water supply probably relied on their own infrastructure, but that period isn't within our timeframe.

Putting this all together, I think it's reasonable to expect that during the Ayutthaya period (until 1767 CE), they had a Drinking Water Supply System in place, especially considering the emphasis on infrastructure for administrative and religious purposes.
</think>

XXXpresentXXX",present
ru_soviet_union,present,"<think>
Okay, so I need to figure out whether a drinking water supply system existed in the Soviet Union between 1918 and 1991 CE based on my knowledge of world history. Let's start by breaking down what a drinking water supply system entails. It seems like it refers to specialized buildings where drinking water is supplied, which could be owned by the state or the community.

First, I know that the Soviet Union was a socialist society under the leadership of the Communist Party. They had a centralized system with strong control over all aspects of governance and industry. Water supply systems are typically associated with infrastructure, so it makes sense to think that the government would have some form of it. 

I remember that during the Soviet era, there were significant efforts to develop infrastructure for cities like Moscow. For example, Moscow was known for its extensive water supply system after World War II. The Soviets invested heavily in creating a reliable source of drinking water, especially since they had to manage shortages due to geographical and environmental factors.

However, I also recall that the Soviet Union faced many challenges post-WWII, including economic difficulties and internal conflicts like the饥寒交迫 (starvation and cold) during the 1930s. These periods might have affected the maintenance of their infrastructure, including drinking water systems. But even so, the state would likely prioritize such systems for public health reasons.

Another point is that many socialist countries in Eastern Europe adopted similar or identical urban planning strategies from the Soviet model after gaining independence. This suggests a pattern where such systems were present post-Soviet transition.

I should also consider if there are any exceptions or specific times when water supply systems might have been absent, but given the time frame of 1918 to 1991, which includes both the Soviet era and the period after the collapse of the Union in 1991. Post-Soviet states inherited many aspects of their former Soviet systems, so it's likely they still had such infrastructure.

Therefore, putting this together, I would expect that a drinking water supply system was present in the Soviet Union during those years.
</think>

XXXpresentXXX",present
gb_british_emp_222222,absent,"<think>
Okay, so I need to figure out whether a specialized drinking water supply system was present in the British Empire between 1850 CE and 1968 CE based on my knowledge of historical politys. The term ""British Empire IIIIIIIIII"" is used here, which might be a typo or perhaps it refers to a specific period within the broader British Empire.

First, I should clarify what the ""British Empire IIIIIIIIII"" actually refers to. It seems like it's likely an error because the word ""empire"" doesn't have ten letters after that point. Maybe it was meant to refer to the British Empire as a whole during a specific time period, perhaps from 1850 to 1968 CE.

Now, considering the time frame of 1850 to 1968 CE, this covers significant events in British history, including the Industrial Revolution starting around 1760-1790, which would have influenced by 1850. By 1968, the empire was undergoing decolonization, especially with the rise of powerful nationalist movements and the start of the British Empire's decline.

Drinking water supply systems vary widely in their presence across different regions and time periods. In urban areas, especially those growing rapidly, having a dedicated water supply system is essential for public health and infrastructure development. For example, the 1850s saw improvements with the cholera epidemic pushing governments to better manage water supplies.

The 19th century was marked by the expansion of railways and cities like London's rapid growth, which would have necessitated better utilities services, including water supply. By 1860, London had a well-developed water supply system, but other parts of the empire might not have been as advanced.

From 1850 to 1968, there was also the impact of colonialism. The British Empire was global, and managing water supplies in colonies would be crucial for their administration. However, during decolonization starting around 1947 with the independence movements, especially in places like India, Africa, and the Caribbean, the British East African Colony, among others, became independent.

Wait, but from 1850 to 1968, the British Empire was also involved in many wars, such as the Boer War (1899-1902), World War I (1914-1918), and World War II (1939-1945). These wars would have disrupted water supply systems as towns and cities were targeted by enemy forces.

Additionally, the British Empire had to deal with internal issues like class divisions and social reforms. The drinking water supply was often part of public health initiatives during this period, though effectiveness varied depending on the region's resources.

Considering all this, it's likely that in many parts of the empire, especially those more urbanized or administrative centers, a specialized drinking water supply system would have been present. However, in less developed regions or under colonial rule, the presence might be absent unless the colony had its own infrastructure.

But wait, the question is about the ""British Empire IIIIIIIIII"" polity as a whole between 1850 and 1968 CE. The term might refer to the entire empire, so I should consider both centralized systems and decentralized ones.

From 1850 onwards, there was a push towards centralization in many parts of the empire due to increasing administrative needs, especially after the defeat during the Boer War which led to internal policies favoring British rule. This might have included better water management.

However, by the late 19th and early 20th centuries, as the empire expanded into new territories through imperialism, managing a centralized water supply system became more challenging, especially with the arrival of new colonies in Africa, Asia, and the Americas where resources were scarce or local governance took over.

Moreover, during decolonization, the British Empire was breaking up, which would have meant losing control over many colonial regions. Therefore, it's possible that the specialized drinking water supply system, being a part of the state's infrastructure, would be absent in these colonies once they became independent.

But wait, the question is about whether it was present or absent within the British Empire IIIIIIIIII polity as a whole during that time. The term ""polity"" suggests a unified entity. However, by 1968, the empire had already declined significantly after decolonization, so maybe the centralized system was less present.

Alternatively, if considering pre-decolonization up to around 1947, perhaps there were still some regions with specialized water supply systems due to their infrastructure development under British rule. However, after independence movements kicked in, many of these systems would have been replaced by local governance structures.

So, putting it all together, I think that during the period from 1850 to 1968 CE, while some parts of the British Empire (like urban centers) had present drinking water supply systems, others, especially those under colonial rule and post-independence, might have been absent due to changes in governance. Therefore, on average, one might expect that it was absent because many areas were losing their centralized control over water supplies as part of decolonization.
</think>

The presence or absence of a specialized drinking water supply system within the British Empire IIIIIIIIII polity between 1850 CE and 1968 CE can be analyzed as follows:

From 1850 to 1968, the British Empire experienced significant changes due to colonialism, decolonization, and internal governance shifts. Urban centers like London developed robust water supply systems by this period, but these were often part of broader centralized efforts under British rule.

However, during this timeframe, many parts of the empire were under colonial administration, where local governance took precedence over centralized systems. Post-independence movements in the mid-20th century further disrupted these systems as colonies gained autonomy.

Thus, while some regions may have retained specialized water supply systems, particularly urban areas, others lost them due to decolonization and changing governance structures. Therefore, on average, one might expect that the specialized drinking water supply system was absent within the broader context of the British Empire IIIIIIIIII polity during this period.

XXXabsentXXX",present
eg_thebes_hyksos,present,"<think>
Okay, so I need to figure out whether an ancient Egyptian polity called Egypt - Thebes-Hyksos Period had a Drinking Water Supply System (DWSS). This system is defined as specialized buildings owned by the polity or community that provide water for drinking. 

First, I'll recall what I know about this period. The Hyksos Period is often associated with the emergence of pharaonic rule and foreign rulers imposing their systems on Egypt. The Thebes-Hyksos period likely refers to a time when Thebes was under Hyksos rule, which started around 1720 BCE according to some sources.

Now, in ancient Egyptian history, water management was crucial for agriculture, industry, and daily life. Pharaohs built reservoirs, canals, and irrigation systems like the ones at Aswan. These were often state-owned because they were vital for sustaining large populations.

During foreign rule, especially from the Hyksos (like the Horemneptanes), rulers would bring their administrative structures into Egypt. This probably included infrastructure such as water supply systems to ensure smooth administration and maintain control over their subjects. The Hyksos likely implemented their own water management systems since they needed reliable water for controlling local populations, crops, and resources.

Additionally, during periods of conflict or foreign domination, the state would invest in robust infrastructure. This could include specialized buildings like reservoirs, treatment plants, and distribution networks that were specifically built to manage water effectively. These systems would help regulate water supplies even under adverse conditions.

I also remember that Egypt's ancient cities had extensive water systems, including the Great Dighri at Abydos which was a massive reservoir complex. This suggests that when a polity is under foreign rule and ruled by pharaohs, they would maintain or build such systems to manage resources efficiently.

Therefore, considering the Hyksos Period involved foreign rulers imposing their governance over Egypt, it's reasonable to expect that they would have established drinking water supply systems as part of their administrative infrastructure. These systems would help in managing the local population, ensuring access to clean water for drinking and other essential needs.
</think>

XXXpresentXXX",absent
fr_la_tene_c2_d,present,"<think>
Alright, so I'm trying to figure out whether La Tene C2-D, a polity that existed between 175 BCE and 27 BCE, likely had a Drinking Water Supply System (DWSS). The question defines DWSS as specialized buildings owned by the polity or community for providing drinking water. If present, I should answer 'XXXpresentXXX'; if absent, 'XXXabsentXXX'.

First, I need to understand what La Tene C2-D was. From my limited knowledge, it's a Neolithic settlement in the Balearic Islands, specifically on the island of Mallorca. It's one of the earliest known human settlements there, dating back around 4000 BCE or earlier.

Now, considering the time frame of 175 BCE to 27 BCE, that period is the Roman conquest and brief restoration in Mallorca. The Romans took over from the Phoenicians around 390 BCE, held control until 28 CE, when a small group of Malcetish (Mallorians) rebelled and restored some sort of autonomy for about 70 years.

So during the Roman rule, which lasted from 175 BCE to 27 CE, what kind of infrastructure would have been expected? The Romans were known for their engineering capabilities. They built roads, public buildings like the Colosseum in Rome, and systems of water supply might have been part of their urban planning efforts.

However, La Tene C2-D is a Neolithic site, meaning it's from much earlier than the Roman period. The DWSS question pertains to the period between 175 BCE and 27 BCE, so I should focus on whether the Roman Mallorians had such systems during their rule or brief autonomy.

I know that some evidence suggests that the Romans established a system of ditches for water supply in Mallorca, but those were likely part of the Roman infrastructure to supplement local wells. The DWSS as we might understand it today—specialized buildings like water towers, reservoirs, etc.—might not have been present because the site is more associated with Neolithic times rather than later periods.

Moreover, during the Roman rule, they might have relied on local sources of water and perhaps didn't develop a specialized system. During their short autonomy in the 27th century CE, the Mallorians may have maintained whatever water systems existed under Roman control, but I don't recall specific evidence of a DWSS during that time.

Therefore, considering the Neolithic origins and the brief Roman period with limited evidence of such infrastructure, it's reasonable to expect that La Tene C2-D did not have a Drinking Water Supply System around 175 BCE to 27 BCE.
</think>

XXXabsentXXX",absent
cn_longshan,present,"<think>
Okay, so I need to figure out whether a Drinking Water Supply System existed in Longshan, which is a polity from around 3000 BCE to 1900 BCE. First, I should understand what the question is asking. The term ""Drinking Water Supply System"" here refers to specialized buildings where drinking water was supplied—either owned by the polity itself or by the community.

Longshan was a Chinese state that existed during the Neolithic period and the early stages of the Iron Age. From what I remember, ancient Chinese civilizations often had sophisticated systems for managing resources like water because it's essential for daily life, agriculture, and transportation.

I should consider when drinking water systems were typically established. In many early state formations, especially in China, there was a focus on centralized governance and infrastructure to support the state's administration. Drinking water would have been crucial for maintaining public order, irrigation, and perhaps even for religious or ceremonial purposes.

Longshan was known to be one of the earliest state systems in China, so it might have had a well-established system. However, I'm not sure about the specifics. I think some sources mention that while many early states developed water management systems, there could be variations based on their geographical and climatic conditions.

The time frame for Longshan was from around 3000 BCE to 1900 BCE, which includes periods of significant historical events, like the Zhou Dynasty unification in 1046 BCE. I'm not sure if that period affected their water supply systems. Maybe the system evolved or changed during this time.

I also recall that some early civilizations relied more on natural resources than others. If Longshan was near a river or had a manageable climate, it might have been easier to maintain a drinking water supply. But without specific historical records about their water management, I can only infer based on the general trends of early state-building.

Another angle is to think about similar polities from that period and whether they had such systems. For example, the Shang Dynasty (c. 1600–1045 BCE) had a system for managing water resources, but that's later than Longshan's existence. Wait, no—Longshan was before that; it existed much earlier. So perhaps by 3000 BCE, there were early signs of centralized systems.

I'm also thinking about the types of buildings associated with drinking water. Are there any records indicating specific structures like reservoirs or irrigation channels? If so, maybe Longshan had specialized buildings for these purposes. Alternatively, if they used natural sources without such infrastructure, then no specialized buildings would be present.

In summary, considering that Longshan was an early state and given the need for a reliable water supply in ancient times, I'm inclined to think that a Drinking Water Supply System might have been present. But I'm not entirely certain because there's limited specific information about Longshan's exact systems compared to later periods.
</think>

XXXpresentXXX",absent
mx_monte_alban_2,absent,"<think>
Okay, so I need to figure out whether a Drinking Water Supply System existed in the polity known as Monte Alban II between 100 BCE and 200 CE. Hmm, I don't know much about this place, but maybe I can think through what I do know about similar historical sites or civilizations.

First, I recall that Monte Alban was an ancient Etruscan city-state located near Lake Trasimeno in Italy. It's one of the few well-preserved urban centers from the 3rd century BCE to the 2nd century CE. I think it was known for its infrastructure because it's been well-preserved, which is rare given how many ancient cities get destroyed or eroded over time.

The period you're asking about is a bit after its supposed decline. Monte Alban II might refer to a later phase of this city-state. I'm not entirely sure if the name 'Monte Alban II' is part of historical records or something made up for the question, but assuming it's accurate, let me proceed.

Drinking water supply systems are specialized infrastructure that polities often invest in to ensure access to clean water for their populations. Many ancient cities had such systems, especially those with growing populations or strategic importance. For example, Roman cities like Rome built elaborate water supply systems with aqueducts and reservoirs.

However, not all cities had this luxury. Smaller towns or city-states might rely on simpler solutions or face challenges in maintaining a continuous supply, especially if they were isolated or depended on natural sources like rivers which might dry up during droughts.

Monte Alban's history: I think it fell under the Roman Empire around 200 BCE and was abandoned by the early 3rd century. But it was known for its fortifications, infrastructure, and maybe even its water supply because of its location near a lake that could provide fresh water. So perhaps during its peak, they had some system in place.

Considering the period between 100 BCE and 200 CE, this might be after their decline but before abandonment. Maybe at first, when the city was prosperous, it had a good water supply, but as it declined, that system might have been phased out or become unreliable.

Alternatively, if they kept maintaining it despite being a smaller polity compared to bigger cities like Rome, then maybe it's present. But given that many small city-states in Italy after their peak often lost their infrastructure due to various reasons including invasions and changing political control, I'm leaning towards absent.

Wait, but the question is about Monte Alban II specifically between 100 BCE and 200 CE. If they were a polity during this period, maybe there's some indication from archaeological findings or historical records if any. Since it's not specified in the user's query, I have to go with general knowledge.

I think that while larger cities would have had such systems, smaller ones like Monte Alban might have been more likely to lose them once their political control ended. So perhaps between 100 BCE and 200 CE, especially after their decline under Roman rule, they didn't maintain a Drinking Water Supply System anymore.
</think>

The presence of a Drinking Water Supply System in Monte Alban II during the period from 100 BCE to 200 CE is expected to be absent. 

**Answer:** XXXabsentXXX",present
