new_name,answer,full,correct
cn_tang_dyn_2,present,"<think>
Okay, so I need to figure out whether the Tang Dynasty II had a drinking water supply system based on what I know about their history. Let me start by recalling what I remember about the Tang Dynasty.

The Tang Dynasty was one of China's most powerful and long-ruling political entities, lasting from 618 CE to 907 CE. It's divided into two periods: the first Tang Dynasty (618–907) and the second tang dynasty (757–907). Wait, so in this question, they're asking about Tang Dynasty II specifically, which was from 763 to 907 CE.

Now, during the Tang Dynasty, China was known for its advanced urban planning and infrastructure. The empire built cities like Changchun in Hebei and Xian (the capital) that were well-planned with roads, canals, and drainage systems. The Great Wall of China is also an example of their engineering prowess.

The drinking water supply system would have involved the construction of channels, canals, reservoirs, and pumps to ensure a continuous water supply for cities and the wider population. These systems were crucial for sustaining populations, especially in arid regions where water was scarce.

I remember that during the Tang Dynasty, there was significant investment in infrastructure projects. The government likely had control over these systems as part of maintaining their urban centers and ensuring daily needs like drinking water, food distribution, etc.

Given that the Tang Dynasty was known for its centralized administration and efficient governance, it's plausible that they had a formalized system for providing clean drinking water. Specialized buildings or infrastructure would have been constructed under imperial or government orders to manage water supply effectively.

Moreover, during the second tang dynasty (757–907), which includes 763–907, there might have been specific projects aimed at improving water resources in response to population growth and regional changes. The government probably maintained these systems to support their expanding empire and cities.

I don't recall any major periods within the Tang Dynasty when such a system would have been absent, especially given the scale of their administrative areas and the resources allocated to infrastructure development.
</think>

The Tang Dynasty II (763–907 CE) existed during a period of significant investment in infrastructure by the Chinese government. Given the centralized administration and emphasis on urban planning characteristic of the Tang Dynasty, it is expected that a drinking water supply system would have been present. This system likely included specialized buildings such as reservoirs, canals, and pumping stations to ensure a reliable water supply for both cities and the population. Therefore, based on historical context and infrastructure investment during this period, I expect the presence of a drinking water supply system.

**Answer:**
XXXpresentXXX",present
cn_western_han_dyn,present,"<think>
Okay, so I'm trying to figure out whether the Western Han Empire had a Drinking Water Supply System. First off, I remember that the Western Han is one of the earliest established Chinese political units, existing from around 202 BCE to 9 CE. This was during the transition between the Qin and Han dynasties in China.

I know that water supply systems were pretty important for any polity because they ensured access to clean drinking water, which is crucial for health and daily life. In more advanced civilizations, especially those with irrigation needs like agriculture, having a dedicated water system would make sense. But I'm not sure about the specifics of the Han period.

The Western Han Empire was located in present-day Shanxi, Gansu, and other regions in what's now northern China. Given that it's in an area with mountains and perhaps some arid or semi-arid conditions, access to water could have been a significant issue. If they had to rely on local rivers or groundwater, maybe they didn't need as much centralized infrastructure.

But the Han Empire was known for its centralized administration and efficient governance. They probably developed various systems to manage resources efficiently. I'm thinking that with such an organized society, they might have invested in some sort of water supply system to ensure a steady water supply, especially considering the growing population during their period.

However, I also recall that early empires sometimes didn't develop complex infrastructure because of logistical challenges or lack of advanced technology. The Qin Dynasty, for example, had water systems but maybe not on the same scale as later dynasties. So perhaps the Western Han Empire was similar in having some basic systems but not as elaborate as later ones.

I'm also considering the role of local communities and if they were self-sufficient enough to manage their own water needs or if they relied more on state-provided infrastructure. If the area had a network of rivers and natural sources, maybe the state didn't need to provide as much. But given that it's in a region with some elevation changes, maybe they did benefit from centralized water management.

In summary, while there might not have been an extremely complex system, it's plausible that the Western Han Empire had some form of drinking water supply system due to their organized nature and the importance of resource management.
</think>

The Western Han Empire, existing from 202 BCE to 9 CE, likely had a Drinking Water Supply System. Given its centralized administration and strategic location in areas with natural water sources, it's plausible that they managed water resources efficiently, possibly through specialized buildings or systems, especially considering the growing population during their period. While not as elaborate as later dynasties, the system would have been present to ensure access to clean drinking water.

XXXpresentXXX",present
co_neguanje,present,"<think>
Okay, so I need to figure out whether a polity called Neguanje between 250 CE and 1050 CE would have had a Drinking Water Supply System. Hmm, I don't know much about Neguanje specifically, but maybe I can infer based on other historical contexts.

First, I should recall what a Drinking Water Supply System entails. It includes specialized buildings owned by the polity or the state, which could be like water towers, reservoirs, or distribution systems. So, if a polity is well-established and has resources to maintain such infrastructure, it's likely they would have one.

Now, considering the time frame of 250-1050 CE, this period covers several civilizations and empires. For example, China had various dynasties like the Han, Three Kingdoms, Jin, Song, and Yuan. During that time, some regions had access to natural water sources or were near rivers which made establishing water supply systems feasible.

I remember that in ancient China, especially during the汉朝 (Han Dynasty), they did have infrastructure for water supply because they used canals and aqueducts. The Han Dynasty built extensive networks to bring water from distant places. So if Neguanje was a polity within this time frame, it might be similar.

Wait, but maybe some smaller or less-resourceful regions didn't have such systems. However, the definition here includes polity owned buildings, so if the state or community had the resources and control over the area, they would probably build it.

Also, considering that between 250 CE to 1050 CE is a period of some stability with empires like the Tang and Song dynasties, which were known for their efficient governance and infrastructure development. So if Neguanje was part of such an empire or controlled region, they would likely have had such systems.

Alternatively, maybe in isolated areas where water sources are scarce, it might be absent. But since the exact location isn't specified, I can only go by general historical context.

I think given the time period and typical infrastructure developments during that era, it's reasonable to expect a Drinking Water Supply System was present.
</think>

XXXpresentXXX",present
co_tairona,present,"<think>
Okay, so I need to figure out whether there was a Drinking Water Supply System in Tairona between 1050 CE and 1524 CE. First, I should understand what Tairona is. From my limited knowledge, I think Tairona refers to the Incas Empire because I remember hearing about it in history class. The Incas were a highly centralized empire located in present-day Peru. They built an impressive network of roads and cities with intricate administrative systems.

Now, considering the time frame from 1050 CE to 1524 CE, that's roughly between the time of Atahualpa, the first Inca emperor, who reigned until his death around 1350 CE, and Pachacuti, the last Inca emperor who was overthrown by Francisco Pizarro. So Tairona would have existed during the height of the Inca Empire.

The question is about whether there was a Drinking Water Supply System (DWSS). This system includes specialized buildings owned by the polity or the community that provide water. For the Incas, I know they had an advanced irrigation system called the Seringo, which used terraced farming and shallow wells to bring water from below the city to the agricultural fields. They also built monasteries, schools, and other structures as part of their administrative centers.

Given that Tairona is associated with the Inca Empire, it's plausible that they had a system for providing clean drinking water. The Seringo system was not just for irrigation but could have been used for domestic purposes too. Additionally, the Incas built many monumental cities and complexes, which might have included water towers or reservoirs as part of their infrastructure.

However, I'm also considering whether such systems were widespread in ancient polities. Many civilizations had some form of water supply, especially those with complex city-states or empires. For example, Mesopotamia had sophisticated irrigation systems for its cities, and Egypt built massive reservoirs. So it's reasonable to think that the Incas would have a system as well.

Another angle is whether there are historical records or inscriptions mentioning a DWSS in Tairona. If such documents exist, they might provide more concrete evidence. However, since I don't have specific information on this particular aspect of Inca history, I'll rely on broader knowledge that the Incas had an advanced infrastructure system.

Also, considering the political structure, the Inca Empire was highly centralized with a well-defined administrative hierarchy. This suggests that they would invest in infrastructure projects like water supply to maintain the health and productivity of their vast population. Clean drinking water would have been essential for both daily life and religious practices.

Moreover, the Incas built the famous quipu, which were accounting devices indicating a highly organized society. Such organization likely extended to other areas including water management. They might have had systems in place to ensure that all cities received adequate water supplies, possibly through reservoirs or networks of canals.

In summary, while I don't have specific information about Tairona's DWSS, the Inca Empire's advanced infrastructure and centralized governance make it highly likely that they had a Drinking Water Supply System. Therefore, I would expect it to be present.
</think>

XXXpresentXXX",present
ec_shuar_1,absent,"<think>
Okay, so I need to figure out whether a Drinking Water Supply System existed in the Shuar - Colonial polity between 1534 CE and 1830 CE. The user defined the presence of such a system as having specialized buildings owned by the polity or its community, which could include the state. 

First, I should recall what the Shuar - Colonial polity was like historically. From what I remember, the Shuar people were a group indigenous to what is now Panama. They formed several independent states throughout their history, often under colonial rule but also engaging in resistance or adapting to it. The period given here is from 1534 to 1830 CE, which covers both Spanish colonial rule and the beginning of post-colonial independence movements.

I know that during Spanish colonial rule, many indigenous groups were forced to adopt European norms, including infrastructure like schools, roads, and sometimes water systems. However, it's also possible that these systems weren't well-integrated or specialized because their main focus was on survival under colonial administration rather than sustainable development.

The Shuar were known for resisting colonial control, often maintaining their traditional governance structures. They had a decentralized system with caciques (local leaders) and sometimes incorporated into the Inca-like administrative systems before the Spanish came. Post-colonial independence in 1823 marks when they broke away from Spanish rule, but that doesn't necessarily mean they abandoned all colonial influences.

In terms of water supply systems, it's possible that even after independence, the Shuar might have retained some colonial infrastructure if it was beneficial to them or if they wanted to integrate with neighboring MIC (Middle Eastern and North African) communities where such systems were more common. However, since they had a history of resistance, maybe they sought autonomy rather than adopting European practices.

I also need to consider whether the absence of a government-run water supply system would leave the community vulnerable. If they didn't have such a system, they might rely on local or community-built solutions, which could be less reliable in an arid environment. But given their history, it's possible that after gaining independence, they either maintained or improved upon existing systems without necessarily having a state-ponsored one.

Moreover, the term ""Specialized Buildings"" suggests that the polity specifically owns the water supply system. If the Shuar were able to maintain or develop their own infrastructure, this would mean the system is present. However, if they relied on external sources like MIC communities for water, it might be considered absent from a purely polity-owned perspective.

Another angle: maybe during their colonial period, they did have some rudimentary water systems to survive, but after independence, these were either maintained or perhaps integrated into larger projects. The Shuar are known for managing their own resources and governance structures, so it's plausible that they might not have adopted the same centralized water supply system as imposed by the colonizers.

In conclusion, considering their history of resistance and autonomy, I expect that a Drinking Water Supply System would be absent because they likely managed without state-imposed infrastructure. However, this isn't a certainty, but based on historical patterns, it's a reasonable assumption.
</think>

The Shuar - Colonial polity, operating between 1534 CE and 1830 CE, was known for its resistance to colonial rule and reliance on traditional governance structures. Given their history of maintaining autonomy and not adopting European practices like centralized water supply systems, I expect the Drinking Water Supply System to be absent.

**Answer:**  
XXXabsentXXX",absent
eg_mamluk_sultanate_3,present,"<think>
Okay, so I need to figure out whether there was a Drinking Water Supply System in Egypt during the Mamluk Sultanate III period between 1412 CE and 1517 CE. Let me break this down step by step.

First, I should recall what the Mamluk Sultanate III was like historically. The Mamluks were an Egyptian military and political dynasty that ruled Egypt for several centuries after their conversion to Islam in the early 13th century. They were known for their efficient administration and military prowess. During their rule, Egypt went through various periods of prosperity and decline.

The Mamluk Sultanate III specifically was active from around 1412 to 1517 CE. That's a significant period because it coincides with the height of Islamic expansion and the rise of other powerful states in North Africa and the Arab world, such as the Ottomans. The Ottomans would later become prominent around this time.

Now, thinking about water supply systems during that era. In ancient Egypt, especially under different dynasties, access to clean water was a major challenge. The Nile River provided much of the region's water, but it was subject to seasonal flooding and irregular flows. Settlers and farmers often relied on the river for drinking and irrigation, which could lead to contamination issues.

Under Mamluk rule, Egypt was part of the greater Arab world, where there were existing systems for water management. The Ottomans, who came into power around 1510 CE, inherited many of these systems. So perhaps the Mamluk Sultanate III had similar infrastructure in place?

I remember that during the Islamic Golden Age (which overlaps with much of the Mamluk period), there were advancements in various fields, including engineering and urban planning. Cities like Cairo were expanding rapidly, requiring proper drainage systems and water supply to support their growing populations.

The Mamlukes were known for building robust infrastructure, including fortifications along the Nile, which indicates a commitment to managing resources effectively. They also had control over key rivers and trade routes, which would necessitate reliable water sources.

However, by the time the Ottomans took over in 1510, the existing systems might have been modified or integrated into their governance. The Ottomans were known for their efficient administration and their ability to adapt to local conditions, so they likely maintained or improved upon any pre-existing infrastructure.

Given that the Mamluk Sultanate III was before the Ottoman period, it's possible they had some form of drinking water supply system in place, even if it wasn't as advanced as what the Ottomans would later implement. The reliance on the Nile might have been supplemented by smaller, local sources or storage facilities.

I should also consider the socio-economic factors. If the Mamlukes were able to control key resources and infrastructure, they probably had systems in place to manage water effectively for their capital cities and administrative centers. This would include buildings with proper sanitation and water supply, even if they weren't as specialized as modern systems.

Additionally, considering the time frame, 14th-century Egypt was part of a larger network where water management was crucial for both domestic use and agricultural productivity. The rulers would have had to invest in infrastructure that supported their growing populations without falling into disrepair due to natural resource fluctuations.

In summary, while I can't be certain about every aspect of the Mamluk period's water supply systems, given their engineering capabilities and the strategic importance of water resources, it's reasonable to expect that they did have a system in place for drinking water. This would include specialized buildings or infrastructure designed to provide a reliable water supply.
</think>

XXXpresentXXX",absent
eg_naqada_1,present,"<think>
Okay, so I need to figure out whether a polity like Naqada I had a drinking water supply system. From what I remember, Naqada I was an early African state in sub-Saharan Africa, existing from around 3800 BCE to 3550 BCE. They were known for their city-building and urban planning. 

First, I should think about when such systems typically develop. Many ancient civilizations started with simple solutions like cisterns or wells but moved on to more complex systems as their needs grew. For example, in the Indus Valley Civilization, they had sophisticated drainage systems. Similarly, Mesopotamia and Egypt developed elaborate irrigation systems for agriculture.

Naqada I was a protoUrban polity, so maybe they didn't have as much need for a specialized water supply system because their society might not have been as large or as dependent on agriculture in the same way as later civilizations. However, urban planning often requires some form of water management to sustain populations and agriculture.

I should also consider if there's any historical evidence suggesting whether Naqada I had such systems. While specific records are sparse, it's possible they used local adaptations. Maybe they had central authorities owning or controlling the water supply through buildings like reservoirs or wells. 

So, putting it all together, it's plausible that a polity of their size and complexity would have a basic drinking water system, even if it wasn't as advanced as later systems.
</think>

XXXpresentXXX",absent
ec_shuar_2,absent,"<think>
Okay, so I'm trying to figure out whether the Shuar polity in Ecuador had a Drinking Water Supply System between 1831 and 1931 CE. The system is defined as having either presence or absence based on specialized buildings owned by the polity or its community.

First, I need to understand what the Shuar were. They're an indigenous group living in the Andes, known for their traditional water systems that relied on rivers and seasonal rains. They built terraced gardens called ""hijos de indio,"" which are still used today. This system is sustainable because it uses natural resources without infrastructure.

Now, considering the time frame from 1831 to 1931, I should think about how their society might have changed. Pre-Columbian civilizations often transitioned from subsistence-based societies to more settled ones as they interacted with colonialism and European settlers in the 16th to 19th centuries. The Shuar's polity would have faced changes like land redistribution, increased agriculture due to new farming techniques or terraced gardens, and the introduction of European crops which might disrupt their traditional water systems.

However, since they are an adaptive society, they probably developed new solutions as they went along. Maybe by the 19th century, they incorporated some colonial technologies into their water systems without abandoning their traditional methods entirely. They might have built earthenware wells or integrated with surrounding natural resources more effectively.

But I'm not sure if this transition would lead to a formal Drinking Water Supply System as we might understand it today. Their reliance on rivers and terracing suggests they might have managed their water sustainably, perhaps without the need for specialized buildings or modern infrastructure like pipes or reservoirs. They were skilled engineers with terraced systems that provided clean water year-round.

So putting this together: if their society remained adaptive and didn't adopt modern water systems due to cultural resistance or because natural solutions sufficed, then maybe the system would be absent in favor of their traditional methods.
</think>

The Shuar polity likely did not have a formal Drinking Water Supply System during the 19th century. They maintained their reliance on natural water sources and terraced gardens, which provided sustainable water without the need for modern infrastructure. Their adaptive society continued to use traditional engineering solutions, integrating with their environment effectively.

**Answer:** XXXabsentXXX",absent
eg_ayyubid_sultanate,present,"<think>
Alright, so I need to figure out whether a polity that existed between 1171 CE and 1250 CE would have had a Drinking Water Supply System (DWSS). The specific example given is the Ayyubid Sultanate. 

First, I should recall what the Ayyubid Sultanate was. From what I remember, it was an Islamic empire in North Africa that existed from around 1171 to 1250 CE. It was known for its administrative efficiency and centralized government.

Now, about DWSS: They are talking about whether a polity owned or provided drinking water through specialized buildings, either by the state or community. So I need to think about how that would have been implemented in a medieval Islamic society.

In ancient times, many civilizations had some form of water management systems, like the Egyptians with their impressive irrigation systems. But as societies became more urbanized and complex, especially under empires or well-established governments, they likely developed infrastructure to manage resources efficiently.

The Ayyubids were known for controlling a large area, so managing water supply would be crucial for agriculture, which was probably a significant part of their economy. They might have had systems in place to ensure access to clean water for both the population and their crops.

Also, since they owned land, including arable areas, it's plausible that they would invest in infrastructure like reservoirs, canals, and maybe even specialized buildings or complexes where water was stored and distributed.

Additionally, under centralized rule, there might have been a system of assigning responsibility for water supply to different regions or units within the polity. This could include building or maintaining facilities centrally.

Considering that the Ayyubid Sultanate was a powerful empire with administrative structures, it's reasonable to expect they would have implemented such a system to manage their resources effectively and maintain their control over the population.
</think>

The polity in question, the Ayyubid Sultanate (1171–1250 CE), being a centralized Islamic empire known for its efficient administration, likely had a Drinking Water Supply System. Given their extensive territory and reliance on water for agriculture, they would have implemented infrastructure to manage resources efficiently.

**Answer:** XXXpresentXXX",present
