new_name,answer,full,correct
in_deccan_nl,present,"<think>
Alright, so I need to figure out whether the Deccan Neolithic polity used iron in their military. Okay, let's start by understanding what Deccan Neolithic is. From what I remember, it refers to a period and region that includes parts of India and perhaps other areas now known as the Deccan in South Asia. The timeframe given is between 2700 BCE and 1200 BCE, which is quite a long span covering several civilizations.

I know that the Neolithic period is generally associated with the development of agriculture, especially wheat and barley, because they were hardier than cereals like rice. This shift from hunting and gathering to farming would have led to changes in society and possibly the organization of labor into settled communities. But how does this relate to military technology?

Well, agriculture necessitated domestication, which required people to settle down and form settlements, leading to the development of more complex social structures. This could have included the rise of early states or city-states as groups of people became organized in ways that allowed for governance.

Now, thinking about metal tools: iron was a late development in human history. It wasn't until around 800 BCE that smelting and refining of iron began to occur in China, specifically in places like the Yangzi River basin. The Chinese were known to use iron swords as early as the 7th century BCE. So, if Deccan Neolithic is before this period, maybe they didn't have access to iron technology.

Wait, but was the Deccan Neolithic referring to a specific area with its own timeline? Maybe it's more about the time frame than a single polity. If parts of the Deccan had different timelines, perhaps some used iron while others did not. But assuming it's the overall region, and considering that the earliest use in China was around 800 BCE, which is within the timeframe of 2700 BCE to 1200 BCE.

But wait, 2700 BCE to 1200 BCE covers a range from the Stone Age through the early Iron Age. The Neolithic period typically refers to when farming became widespread around 8000-4000 BCE in Europe and then spread globally. So by 2700 BCE, many regions had already started using iron tools because it was becoming more common as metallurgy advanced.

So if the Deccan Neolithic polity existed between these dates, they might have used iron in their military. But I'm not entirely sure about the specifics for this particular region. Maybe there are regional variations or specific uses of iron in warfare that developed later.

Another angle: military technology often follows as a result of larger societal changes. If agriculture and domestication were already widespread by 2700 BCE, then it's plausible that some forms of metallurgy would have been used for tools, including weapons like swords or axes. But iron wasn't the first metal to be used in warfare; copper and bronze had been around longer.

I think by 1200 BCE, many parts of what is now India were under various civilizations, some of which did use iron. For example, the Indus Valley Civilization was around 3300-1300 BCE, but they didn't necessarily use iron. However, later periods like the Maurya Empire in central Asia had access to better metallurgy and used iron extensively.

Wait, but if Deccan Neolithic is referring to a specific region, maybe it's more regional. The Deccan platforms in India are associated with ancient trade routes and perhaps contacts with other regions that had already developed iron technology. So perhaps by 1000 BCE or so, iron would have been present.

But I'm not entirely certain because the time frame is from 2700 BCE to 1200 BCE, which includes both periods where iron was available and maybe even some without it in different regions. However, considering that the earliest use in the region we're talking about might be around the 8th or 9th century BCE, as per some sources, it's possible that by then they were using iron.

So putting this all together, I think it's reasonable to expect that Iron was present in their military during the Deccan Neolithic period. Therefore, I would answer 'present'.
</think>

XXXpresentXXX",absent
in_deccan_nl,absent,"<think>
Alright, so I'm trying to figure out whether the Deccan Neolithic polity, which existed between 2700 BCE and 1200 BCE, used iron in their military. I know that iron was a major technological advancement that transformed societies when it became available.

First, I should consider when iron was invented globally. From what I remember, the development of iron smelting is usually attributed to China around the 14th century BCE, but there are reports of metalworking with iron from other regions as well. However, Deccan in India, which includes modern-day states like Maharashtra and Gujarat, might have been an exception.

The Deccan region is known for its rich culture and agriculture, especially from the Harappan period onward (around 3000 BCE). But does that mean they used iron? I don't recall specific evidence of iron weapons or armor in their artifacts. The earlier periods, like the Mohite Mahadesi culture around 500-100 BCE, are more associated with stone tools rather than metal ones.

Also, considering the time frame—2700 BCE to 1200 BCE—the earliest evidence of iron use might not have reached the Deccan region yet. The spread of technology can take time, and if the Deccan was isolated geographically, they might have lagged behind other regions in adopting metal technologies.

Moreover, military use of metals like iron would require a level of metallurgy expertise that wasn't widespread until much later. Since the Deccan Neolithic period is earlier than when iron became common, it's plausible that they didn't have access to or used iron in their military gear.

I should also think about regional factors—like trade networks, proximity to metal sources, and cultural influences. If there was no contact with regions where iron was already being used, the Deccan might not have adopted it early on.

So, putting it all together, while iron became available earlier than one might think globally, the Deccan Neolithic polity likely didn't use iron in their military because they either lacked access to it or didn't need it for defense at that time.
</think>

XXXabsentXXX",absent
in_deccan_nl,present,"<think>
Okay, so I need to figure out whether the Deccan Neolithic polity, which existed between 2700 BCE and 1200 BCE, used iron in their military technology. I'm not very familiar with ancient history, but I know a bit about early civilizations and metallurgy.

First, I remember that the use of iron is often linked to the development of metalworking techniques. Early humans had stone Age tools made from flint or other stone, but as societies became more complex, they started using metals like iron for weapons because it's harder and more effective than stone.

The Deccan region, which includes places like Maharashtra and Karnataka in India, is known for its rich history and diverse cultures. During the Neolithic period (around 2700 to 400 BCE), there were several civilizations emerging, such as the Indus Valley Civilization. I think iron was definitely used in that era; they had metal weapons like swords and shields.

But wait, the Deccan Neolithic polity specifically spans from 2700 BCE to 1200 BCE, which is a longer period that includes not just the Indus Valley but also other periods. The Vedic period (around 1500 BCE) comes before this, and I don't recall iron being used then because metallurgy really took off later with the Iron Age.

Also, during the Iron Age in India, which is when iron was widely used, it probably started around the time of the decline of the Indus Valley Civilization. The Deccan region had various kingdoms and civilizations emerging during this period, each possibly using iron for military purposes.

I should consider if there are any records or artifacts from the Deccan region that indicate the use of iron in warfare during this time. From what I know, trade routes and contacts with other regions might have introduced iron-making techniques, but it's not clear whether the locals were already using it.

Another angle is to think about the broader context of metallurgy. The development of iron was a gradual process that spread from China through the Blacksmithing Area in Eurasia. It probably reached the Deccan region via trade or migration after the initial Iron Age began.

So, putting this together, while there's no direct evidence specific to the Deccan Neolithic polity about iron use, the general trend suggests that as metallurgy advanced during their period, iron weapons likely became more common in military technology.
</think>

XXXpresentXXX",absent
mn_hunnu_early,present,"<think>
Okay, so I need to figure out whether the Early Xiongnu used metal, specifically iron, for their military. The time frame is between 1400 BCE and 300 BCE. Hmm, let me break this down.

First, I know that the Xiongnu were a significant group in Chinese history. They were originally from Central Asia, around what's now Uzbekistan or southern Russia. They are mentioned in various ancient texts like the Qin Shi Huang biographies and the Guo Shengzi of Han Yu. I remember that they were known for their military prowess.

Now, considering the time period: 1400 BCE to 300 BCE. That's a long span, covering both the early stages of Chinese history under the Qin Dynasty (which started around 221 BCE) and into the Hellenistic era in China, which was actually earlier than that but more about regional cultures. Wait, no, Hellenistic influence might not be relevant here; I'm focusing on military use.

I recall that iron was introduced to the Chinese region much later. The Han Dynasty (206 BCE – 87 CE) is generally credited with the mass production of iron in China. Iron was revolutionary because it allowed for better weapons and armor, increased armie efficiency, and was used extensively in battles. Before that, weapons were made from stone, bone, or other less durable materials.

The Early Xiongnu might have been around before 300 BCE, so during their time period, did they use iron? Well, if the earliest references of the Xiongnu are around this time frame, it's possible that some used iron. But I also know that not all groups in that region necessarily adopted iron at that point.

Looking into history, there's evidence that the Parthian Empire (which later became the Xiongnu) were using iron weapons as early as 200 BCE or so. The Parthians are known for their military effectiveness, and their use of iron would have given them a significant advantage in battles against the Chinese kingdoms.

Also, considering that the Qin Dynasty started around 210 BCE with their great wall, it's likely that the Xiongnu were involved in conflicts that required advanced weaponry. If they weren't using iron, their military might not have been as effective. So, given the context of a polity active during this period and the Parthian influence, I would expect them to have used iron metal for warfare.

Wait, but could there be exceptions? Maybe some smaller groups or isolated communities within the Xiongnu didn't use iron yet. But since they were involved in military conflicts as a polity, it's reasonable to assume that at least some of their units did use iron by 300 BCE.
</think>

XXXpresentXXX",absent
mn_hunnu_early,present,"<think>
Okay, so I need to figure out whether the early Xiongnu used metals like iron for their military. The time frame is from 1400 BCE to 300 BCE, which places them somewhere in the Iron Age, but specifically when? I remember that the use of iron became more widespread around the 8th century BCE, especially in China. So maybe by 500 BCE or so, they started using iron weapons.

The Xiongnu are an important pre-Modern Chinese group, and from what I've read before, they were known for their military ingenuity. They were involved in some significant battles, like the One Hundred Days War against Genghis Khan's Mongols. That war took place around 1296–1307 CE, which is after the period we're considering (up to 300 BCE). Wait, that can't be right because our time frame ends at 300 BCE, so maybe I'm confusing the timeline.

Wait, no, the Xiongnu existed from around 1400 BCE down until their decline, which was perhaps during the Qin Shi Huang era. The One Hundred Days War actually happened in the 14th century, which is after the Xiongnu's decline but before the Mongols arrived. So maybe they used metal weapons earlier on.

But considering that the use of iron in China can be traced back to at least the 7th or 8th century BCE when it was introduced from India via Alexander the Great's campaigns. The Xiongnu might have come into contact with these metallurgical techniques through trade routes, perhaps along the Yangtze River or other regions.

Moreover, the Xiongnu are known for their use of stone weapons like the wounding stick and bamboo swords, but they also used metal weapons when needed. If they were part of larger campaigns or facing formidable opponents, it's plausible they adopted iron sooner than later. So by 300 BCE, which is earlier than the time of their decline, they might have already been using iron in their military.

However, I should check if there are any specific records or sources that mention the use of iron by the Xiongnu before a certain period. If no such evidence exists, maybe it's absent until proven otherwise. But given their strategic importance and the trend towards technological advancement as empires rise, it seems likely they adopted iron earlier in their history.

Also, the spread of metallurgy isn't always synchronized with military use; sometimes it takes time to develop production or distribution systems necessary for widespread use. So maybe by 300 BCE, when the Xiongnu were still a dominant force, iron wasn't yet fully integrated into their military tech, but they might have started using it more as needed.

But wait, considering that the One Hundred Days War was in the late 13th century and the Xiongnu had declined by then, perhaps prior to that, around say the 6th or 7th century BCE, iron weapons were already in use. Therefore, within their timeframe up to 300 BCE, they would have incorporated metal military tech.

So putting it all together, I think the answer is present.
</think>

XXXpresentXXX",absent
fr_hallstatt_d,present,"<think>
Okay, so I need to figure out whether the polity Hallstatt D used iron in their military around 600 BCE to 475 BCE. Let me start by recalling what I know about Hallstatt D.

Hallstatt was a Hittite city-state that existed during the Bronze Age. The period given is from 600 BCE to 475 BCE, which fits within their known history. Now, I remember reading that around 1300 BCE, there was a period in Anatolia where iron wasn't available, often referred to as the ""Dark Age."" But then by about 900 BCE, Hittites were using iron for metallurgy.

Wait, so if Hallstatt D was active after 600 BCE, which is later than the Dark Age (which ended around 850-900 BCE), they might have had access to iron. But let me think more carefully. The Dark Age in Anatolia started around 1300 BCE and lasted until about 724 BCE for the Assyrians. So if Hallstatt D was active after, say, 600 BCE but before 400 BCE, they might have been using iron.

I should also consider that Hittites were known to be quite advanced in metallurgy around this time. They used iron in weapons and armor long before the Greeks started using it. So by 600 BCE, it's plausible that Hallstatt D was already utilizing iron for military purposes.

Moreover, there are sources suggesting that Hittite metallurgy reached a high level of sophistication during their peak period. If they were a military polity, developing and using iron would be essential for their war efforts. Therefore, it makes sense to expect that Iron was present in their military use.
</think>

XXXpresentXXX",present
id_buni,present,"<think>
Okay, so I need to figure out whether the Java-Buni Culture used iron in their military. First, I should understand who they were and when they existed. The Java-Buni Culture was a polity from around 400 BCE to 500 CE, primarily based in present-day Indonesia. It's an ancient society that had various kingdoms and empires.

I know that the Bronze Age is a period where Bronze was the primary metal used for weapons and armor. So between 3200 BCE and 1600 BCE, Bronze Age cultures were using iron for some of their military gear, though perhaps not exclusively or in large quantities. The Java-Buni might have been part of this trend.

But then I remember that the Chinese Han Dynasty (206 BCE to 220 CE) was a time when Iron began to be used more extensively in warfare and construction. There's evidence like the Warring States period where soldiers used iron swords, and battles were devastating because of the superior strength and effectiveness of iron weapons.

However, the Java-Buni Culture was in Indonesia during their period. I'm not sure about their specific military practices or whether they adopted iron from elsewhere. Some cultures in that region might have been influenced by Chinese or other neighboring civilizations. If trade routes existed between Java-Buni and China, maybe they imported iron tools or weapons.

On the other hand, if the culture was isolated, it's possible they developed their own technology independently. But given the proximity to the Chinese Empire during the 3rd century CE (when Saka Kingdom was prominent), there might have been some cultural exchanges. The Chinese were using iron by then, so perhaps that knowledge spread.

So, considering the time frame and potential influences, it's plausible that the Java-Buni Culture used iron in their military around some point between 400 BCE and 500 CE.
</think>

XXXpresentXXX",absent
id_buni,absent,"<think>
Okay, so I need to figure out whether the Java-Buni Culture used metal iron for their military during the period between 400 BCE and 500 CE. Hmm, let's start by recalling what I know about this culture.

The Java-Buni Culture was an important pre-Islamic civilization in the Indian subcontinent, especially known from the region of Java, which is now part of Indonesia. They flourished during the Common Era (CE) but also extended into BCE. Their history spans from around 500 BCE to 800 CE, I believe.

Now, about military use of metals, specifically iron. From what I remember, the use of iron in metallurgy and metalwork is a relatively late development in human history compared to other materials like stone or bronze. Iron was first used for swords and armor much later because it requires high melting points and isn't as readily available. The knowledge of how to work iron into useful shapes probably came after some initial experimentation.

The Bronze Age comes to mind, which is when people started using bronze, a mix of copper with tin, around 3500 BCE in China. Iron was then introduced later, perhaps starting around the time of Alexander the Great's campaigns in the mid-3rd century BCE. His victories are often cited as bringing iron metallurgy to the scrolls of Asia Minor because his armies were so effective that they influenced nearby cultures.

Wait, but the Java-Buni Culture existed before and after Alexander's time. They were in Java, which is now part of Indonesia, located along the coast of the Indian Ocean. The maritime routes during Alexander's time went through the Strait of Malacca, so it's possible their trade and military interactions might have been influenced by these sea lanes.

But does that mean they used iron? I'm not sure because the introduction of iron would take time to spread. Let me think about the timeline. Java-Buni was flourishing around 500 CE, right after Alexander's death. If iron became available from the Hellenistic world through trade or conquests by Alexander's successors, maybe it could have reached Java.

However, if their period is between 400 BCE and 500 CE, that includes both before and after Alexander. So perhaps in parts of Java-Buni Culture closer to the Malacca Strait, they might have been influenced by Hellenistic or other cultures where iron was used earlier.

But I'm also recalling that some cultures in the Indus Valley had some advanced metallurgy as early as 3000 BCE, but that's much earlier than the Java-Buni period. The use of iron for swords and armor is more common in later periods like the Gupta Empire (CE 320–550), which overlaps with the end of the Java-Buni culture.

Wait, so if the Java-Buni Culture existed from around 400 BCE to 500 CE, their military would have had access to iron as late as 500 CE. But was it present earlier?

I think there's a possibility that some regions within Java-Buni started using iron before Alexander's time because their location is along the coast and might have had contact with other maritime cultures where iron was being used or imported.

But given that the question asks specifically for whether it was present or absent, I should consider if there are any records or evidence of iron use in military contexts during this period. If I can't find such evidence, maybe it's safer to say it was absent because the earlier known uses were much later.

Alternatively, maybe by 500 CE, after Alexander's influence had faded, iron could have been introduced through other means like trade from China or other parts of Asia Minor. But without specific evidence, it's hard to confirm.

So, putting this together: The Java-Buni Culture existed around the same time when Hellenistic influences were declining in their region but may have still come into contact with areas where iron was being used. However, without direct evidence from that period showing military use of iron weapons or armor, I might lean towards it being absent.

But wait, the Gupta Empire (CE 320–550) is known for using iron swords and armor extensively in their military campaigns, which were part of their expansion into the Indus Valley. So perhaps by CE 500, when Java-Buni was declining or ceasing to exist, they might have still been using iron.

But considering that the peak of Java-Buni's flourishing was around CE 600s under the Delhi Sultanate, which is after their period, it's possible that in earlier times, iron wasn't prevalent. So maybe during their active military period (400 BCE–500 CE), they didn't use iron.

Alternatively, if some regions within Java-Buni started using iron from earlier periods, like the 3rd millennium BCE, perhaps by 500 CE it had spread enough to be used in their military. But without specific evidence of that time period, I'm not sure.

I think the safest answer is 'absent' because, during their active period (400 BCE–500 CE), there's no known evidence or record indicating that they used iron for their military technology.
</think>

The Java-Buni Culture existed from approximately 400 BCE to 500 CE. During this period, the use of iron in metallurgy and metalwork was not prevalent. While some regions within the Java-Buni culture may have had contact with maritime cultures where iron was being used or imported by later periods, there is no specific evidence indicating that they employed iron as a military technology during their active period.

Answer: XXXabsentXXX",absent
us_haudenosaunee_1,present,"<think>
Okay, so I need to figure out whether the Military use of Metals: Iron was present or absent during the Haudenosaunee Confederacy between 1566 CE and 1713 CE. Hmm, let's break this down.

First, I'm not super familiar with the Haudenosaunee Confederacy, but I think it's related to the Mohawk people in North America. They were a significant group around the Great Lakes region before European colonization. So their history would include various conflicts over trade routes, lands, and alliances.

Now, about the military use of iron: Iron was widely used in weapons and armor long before European colonization. I remember that in many Indigenous cultures, they made tools with iron as well. For example, the Mohawks were known for their skilled craftsmanship, including making arrows, weapons, and other equipment. So it's possible they had access to metalworking technologies.

But wait, during that time, were European traders involved? The period from 1566 to 1713 includes the arrival of English settlers in North America around 1607 with the Roanoke Colony, but that's not part of the Haudenosaunee Confederacy. However, later on, European colonization and trade would have introduced new materials and techniques. Maybe the use of iron evolved as they interacted with outside forces.

I should also consider if there were any specific events or conflicts where iron weapons were used. If the Haudenosaunee Confederacy engaged in battle during that time, it's likely they might have used iron. But I don't recall specific battles mentioned for this group; more known are their diplomatic and conflictual relationships with other groups.

Additionally, prior to 1566, Indigenous peoples were using iron for various purposes, so it's reasonable to assume that by the mid-16th century, they would have incorporated iron into their military gear. The knowledge of metallurgy doesn't necessarily require direct contact with European settlers; it can come from other Indigenous groups or through cultural exchange.

Therefore, putting this all together: while the Haudenosaunee Confederacy didn't engage in warfare during that period (as far as I know), they likely had access to iron-based technologies before that time. So when considering their military use of metals: iron, it would be present.
</think>

XXXpresentXXX",absent
