new_name,answer,full,correct
jp_yayoi,present,"<think>
Okay, so I need to figure out whether the Kansai region during the Yayoi Period used iron in their military. The time frame is from 300 BCE to 250 CE.

First, I remember that the Yayoi Period was a time of significant cultural and technological development in Japan. They were known for their advancements in various fields like metallurgy. Let me think about what was happening during this period.

Iron was known to have been used before in Japan, right? The Kamikura culture, which came before the Yayoi, used iron swords. That's when samurai started becoming common. So if the Kamikura had iron weapons by 700 BCE or so, then moving forward into the Yayoi Period would make sense that they might have continued using and improving upon those technologies.

Moreover, the Yayoi were known for their military ingenuity. They often engaged in fierce battles against neighbors like the Silla and Korea. If they used iron weapons, it would make sense they were effective fighters during these conflicts. The development of better armament would give them a strategic advantage, so using iron would be expected as part of their military strategy.

Also, considering the spread of ideas and technologies, if the Kamikura already had iron metallurgy, it's likely that it was passed on or adapted by the Yayoi. They were also known for their infrastructure advancements, like roads and drainage systems, which might have included better siege techniques that could be enhanced with metal tools.

So putting this together, I think it's reasonable to conclude that the Kansai region during the Yayoi Period did use iron in its military. It aligns with earlier examples of the Kamikura, their military needs, and the diffusion of technology.
</think>

The Kansai region during the Yayoi Period (300 BCE–250 CE) likely used iron in its military. This conclusion is based on the fact that the Kamikura culture, which precedes the Yayoi, already utilized iron metallurgy around 700 BCE. The spread of this technology would naturally have influenced the Yayoi's military practices, enhancing their effectiveness in battles and strategic conflicts with neighboring powers like Silla and Korea. Additionally, the Yayoi were known for their technological innovations, including infrastructure improvements that could have been supported by iron tools.

**Answer:** XXXpresentXXX",present
kh_angkor_2,present,"<think>
Alright, so I need to figure out whether the Classical Angkor polity between 1100-1220 CE used iron in their military. Hmm. Let's break this down.

First, what do I know about Classical Angkor? It was a huge empire in Cambodia, known for its impressive architecture like the Angkor Wat temple and the riverside capitals. Their people were known for being skilled artists and having a vibrant culture. But when it comes to military tech, I'm less certain.

I remember that many ancient civilizations used various weapons before iron became widespread. For example, swords made of iron were used in some parts of the world much earlier than in Angkor. Also, bronze was commonly used for weapons, so maybe Angkorian soldiers had access to it too.

Wait, but when did iron actually come into use? I think that in Europe, iron began to be used around 1500 CE with steelmaking, making swords and armor possible. But in other parts of the world, like China, by the time of the Zhou Dynasty (around 1046-256 BCE), they were already using some form of metal technology. Maybe Cambodia had access to iron earlier.

So if Angkor was a part of Siamese Thailand before 1300 CE, perhaps they got iron from there or imported it from other regions that had already used it in their military. Thailand did use iron weapons, so it's possible Angkor would have too once they came into contact with the region.

Also, considering the size and resources of an empire like Angkor, they likely had access to materials needed for advanced weaponry. They probably traded or were influenced by neighboring regions that used iron. Plus, their cities were built using bricks made from iron-bearing laterites, which suggests that iron was common in construction but maybe not necessarily in military gear.

I should also think about the types of warfare during this period. If the polity was focused on large-scale military campaigns or invasions, they would need more efficient weapons. Iron could provide greater armaments and might have been used for sieges or other equipment as well.

But I'm not entirely sure if it's definitely present because maybe they were still using bronze, which is more readily available without special metallurgy skills. Unless there was a specific reason, like the need to secure borders with better tools, that would push them towards iron.

Another angle: if neighboring regions had adopted iron tech earlier, there might have been an influence on Angkor. The Siamese rulers before 1300 definitely used iron, so it's plausible they adopted it as well once their empire expanded into Cambodia.

Wait, but when did the Siamese take control of Cambodia? Before or after 1200 CE. If the polity was from 1100-1220, by 1200, they might have been integrating with a society that already used iron. So it's likely they incorporated it into their military around then.

Also, considering that the Classical Angkor period overlaps with when other regions like the Sisaket Kingdom in Thailand were using iron weapons after c. 1300 CE but that's later than the time frame of Angkor. Wait, no, actually, if Angkorian empire expanded into Siam before that, maybe they already had access.

So putting it all together: The polity existed from 1100-1220, which is when iron technology was likely spreading or being adopted elsewhere. They were influenced by neighboring regions with access to iron, so it's reasonable to expect that iron would have been used in their military around this time.

Therefore, I think the military use of metals: iron was present during the Classical Angkor period.
</think>

XXXpresentXXX",present
kh_angkor_1,present,"<think>
Okay, so I need to figure out whether the historical polity known as Early Angkor, which existed from 802 CE to 1100 CE, used iron in their military technology. The question is asking specifically about the presence or absence of iron as a military technology during that time.

First, I should recall what I know aboutEarly Angkor. It was one of the largest city-states in Southeast Asia for a long time. They were known for their impressive architecture and administration. But when it comes to military technology, especially regarding weapons and armor, I'm not entirely sure if they used iron or if they stuck with other materials.

I remember that during the early medieval periods, many regions adopted iron as a primary weapon because it was more efficient and harder than stone or metal. For example, the Mongol Empire, which spans much of Central Asia and includes parts where Early Angkor might have been located, was known for using iron weapons extensively in their military campaigns.

But wait, Early Angkor is more specifically associated with Siamese history. It was part of the Siamese Empire under King Sisaket, who made it a center of administration and culture. Siamese kings were skilled warriors, so they might have adopted various technologies to enhance their military effectiveness.

Iron weapons became widespread in Southeast Asia after the introduction from neighboring regions. The Chinese had already been using iron swords by the 6th century CE, which they brought along during their expeditions into Vietnam. By the time Early Angkor was flourishing (around the late 9th to early 10th centuries), it's likely that iron weapons were already in use there.

I also think about the role of trade and contact. If neighboring regions like Thailand or even China were using iron, it would have been possible for them to introduce it to Siamese kings. Plus, military campaigns required efficient armaments, so adopting iron would give them a strategic advantage over other neighboring powers who might still be using stone or other less durable materials.

Moreover, the administrative efficiency of Early Angkor and its centralized system probably meant that if they were adopting new technologies, it was likely for organizational purposes as well. If they were using iron weapons, it could help in organizing large-scale battles more effectively.

But I should also consider if there are any historical records or inscriptions fromEarly Angkor that mention their military technology. From what I remember, historical texts often describe the Siamese Empire's military strategies and armaments, but without specific mentions of iron unless they were using it as a defining feature. However, given the time period and neighboring influences, it's quite plausible they had access to iron.

Also, considering the broader context of the 9th to 10th centuries CE, this was a period when many Southeast Asian states began to adopt iron metallurgy. The transition from stone weapons to metal ones wasn't just limited to one region; it spread across much of Asia and Africa around that time.

In summary, even though Early Angkor is known for its cultural and administrative achievements, the shift towards using iron in military technology was likely already happening during their peak period. It would make sense for them to have adopted this advanced material for enhancing their warfare capabilities.
</think>

XXXpresentXXX",present
kh_angkor_3,present,"<think>
Okay, so I need to figure out whether the military use of metals, specifically iron, was present during the Late Angkor period, which is between 1220 CE and 1432 CE. Let's start by understanding what exactly is being asked here.

First, the question defines ""military use of metals: Iron"" as either absent or present. That means I need to determine whether iron was used in military technology during that time for warfare. I should consider both the historical context and any evidence about military practices during this period.

I know that Angkor was a significant polity, especially under the Khmer Empire, which flourished from around the 12th century CE up until its decline after Chakri rule began in the early 16th century. The Late Angkor refers to the time when Angkor had lost its independence and was ruled by the Chakri dynasty of Thailand.

So, between 1220 and 1432 CE, Angkor was part of the Thai Empire under the Siamese kings. I remember that Thailand is known for using iron in its military equipment. For example, during the Ayutthaya period (which overlaps with Late Angkor), Thailand used iron swords called ""takvasin,"" which were more advanced than earlier weapons like bamboo or reed ones.

Also, there's evidence of iron being used in broader military contexts beyond just the royal army. The Siamese kings, such as Chakri kings and their successors, seem to have employed iron in various aspects of warfare. This includes not just the elite forces but also auxiliary units known as ""sangkhets,"" which were local militias. These groups often used iron weapons even during periods when they weren't part of the main army.

Additionally, there are historical records that mention the use of metal weapons by Siamese warriors. Some sources suggest that iron played a crucial role in battles against other empires and kingdoms, enhancing Thailand's military capabilities significantly.

Considering all this, it seems plausible that iron was indeed used as a military technology during the Late Angkor period. The Thai Empire's transition to using iron likely contributed to their dominance over neighboring regions, which would have been a significant factor in their military effectiveness.

Therefore, putting it all together, I would conclude that the military use of metals: Iron was present during the Late Angkor period.
</think>

XXXpresentXXX",present
kh_khmer_k,present,"<think>
Alright, so I have this question about the Khmer Kingdom's military use of metals, specifically iron. The time frame is from 1432 CE to 1594 CE. First, I need to recall what I know about the Khmer Empire.

Khmer Empire was a vast empire in Southeast Asia, stretching from modern-day Cambodia, Laos, Thailand, and into parts of Vietnam. It was known for its impressive architecture, especially Angkor Wat, and their advanced city-states like Siem Reap. They were also known for their role as traders and colonizers during the 15th century.

Now, thinking about military technology in that period. I remember that many Southeast Asian societies were heavily reliant on metals, but iron specifically? From what I've learned before, China was one of the earliest to use iron in weapons, around the 2nd century CE. They used it for arrows and swords. Then, by the 6th or 7th century, other regions like Japan started using iron as well.

Khmer Kingdom, being influenced by Chinese culture, might have had access to iron from China. However, there's also a lot of uncertainty because not all kingdoms in Southeast Asia necessarily adopted Chinese technologies. For example, the Aztecs in Mesoamerica didn't use iron until much later, around the 15th or 16th century.

The Khmer Empire was also dealing with constant threats from neighboring powers like the rival Siamese Empire and the Central Asian rulers who sometimes took control of parts of their territory. If they were using iron weapons, that would make sense in a region where warfare is common. The presence of metals suggests trade routes and possibly contacts with regions known for metal production.

Another point to consider is the economic factors. If the Khmer Empire was trading extensively, they might have sourced materials from various regions. China's influence was significant, so it's plausible that iron weapons were available through trade or direct contact. However, it's also possible that they developed their own metallurgy techniques independently.

I should also think about any historical sources or inscriptions. If there are any records mentioning the use of iron in warfare by the Khmer Empire during those centuries, that would support its presence. But I don't recall specific mentions; however, considering their extensive trade and contact with regions where iron was used, it's more likely than not.

In summary, while it's uncertain without specific evidence, the trend towards using metals like iron in warfare makes it probable that the Khmer Kingdom did use iron military technology during that period.
</think>

XXXpresentXXX",present
kh_funan_1,present,"<think>
Okay, so I have this history question about whether the polity Funan I used metals, specifically iron, for their military during a certain period. The time frame given is from 225 CE to 540 CE. I'm not super familiar with Funan I, but I know it's an ancient Chinese kingdom or maybe an empire, possibly related to Han China.

First, I should figure out what Funan I refers to. From what I remember, there was a kingdom called Funan in the history of China, which might have been part of the Han dynasty or perhaps a later period. I think it's associated with the Xiaozu period, but I'm not entirely sure about that.

Now, regarding the use of metals, specifically iron, for military purposes. I know that during the time of Funan I (225 CE to 540 CE), which falls within the Tang and Five Dynasties periods in China, there was a significant development in metallurgy. Iron was definitely used extensively by various Chinese kingdoms. The Han dynasty is famous for its use of iron weapons.

So, if Funan I was an advanced society during this time, it's likely they had access to iron technology. But wait, did Funan specifically employ iron? I recall that the Five Dynasties period saw a lot of military innovation, with each ruling family developing their own military technologies. The Tang dynasty, for example, was known for its use of iron swords and armor.

Given that Funan might have been a small kingdom in the north or west during this period, they would probably adopt military technologies from broader trends but might not necessarily have developed them themselves unless there were local incentives. Iron was a global phenomenon by then; perhaps it had already spread beyond China before Funan's time.

But considering the time frame (225 CE to 540 CE), which includes periods like the Sui and Tang dynasties, I'm more confident that iron would have been available for military use. Funan being part of a larger network where iron was already being used by neighboring regions makes it probable they used it too.

I should also think about the materials available at the time. By 200 CE, the use of metal weapons in China was well-established, so by 540 CE, they were definitely using iron. Funan I would likely be part of a larger polysystem where such technologies were already present and possibly used.

Therefore, my initial thought is that the military did use metals, specifically iron, during their time.
</think>

XXXpresentXXX",present
kh_funan_2,present,"<think>
Okay, so I need to figure out whether the polity Funan II, which existed from 540 CE to 640 CE, used iron in their military technology during that period. First, I should understand what Funan II is—I think it's an ancient Chinese state or territory. Maybe it was a kingdom under the broader Han dynasty? That might be important because the Han dynasty was known for its advancements in various fields.

I remember that China had a lot of technological innovations during this time. For example, paper was invented around 105 AD by蔡伦，and gunpowder was developed much later, though I'm not sure if Funan II had access to it. But the question is about military use of metals, specifically iron.

I know that iron was crucial for metallurgical advancements and military applications in ancient times. The Chinese were known for their use of metal weapons as early as the Han dynasty. Swords, shields, armor—I think they used iron during that period. So if Funan II was part of or aligned with a larger Chinese state like the Han, it would make sense that they had access to iron metallurgy.

But wait, Funan II might be a specific polity rather than a major empire. I'm not entirely sure about its exact scope. If it was a small state within China, maybe it didn't develop its own military technology or didn't use iron because it was isolated? But then again, being part of a larger network that used iron would mean they probably did too.

Also, the period from 540 to 640 CE falls under the Tang dynasty in China. The Tang period is when significant advancements in technology and metallurgy happened, including the use of metal swords called cuourry or cuanyin. So it's likely that any polity active during this time would have access to iron metallurgical techniques.

Putting this together, Funan II probably did use iron for military purposes because it was within a broader context where such technology was already established and used.
</think>

XXXpresentXXX",present
kh_cambodia_ia,present,"<think>
Okay, so I need to figure out whether the military use of metals like iron was present during the Bronze Age Cambodia between 500 BCE and 224 CE. Hmm, let me start by recalling what I know about Cambodia's history.

First off, Cambodia is often referred to as the ""Land of the Cambridge"" because of its massive rivers that shaped its landscape. The Khmer Empire was a significant polity in Southeast Asia during this period. Now, I remember that iron was a revolutionary metal for warfare. It's much harder and more durable than stone or other materials, which made it ideal for weapons like swords, armor, and shields.

I think that by the time we're talking about the 5th century BCE to around 200 CE, many civilizations in the region were already using iron. For example, China had advanced metallurgy much earlier, producing high-quality steel. Similarly, the Indus Valley Civilization was known for their iron weapons and armor. So it's plausible that Cambodia might have adopted iron technology.

But wait, I should consider the historical context specific to Cambodia. The Khmer Empire expanded through various military campaigns and built infrastructure like dams and roads. Their cities were well-developed with grand architecture, which suggests advanced construction techniques. If they had access to iron tools or weapons, this would align with their architectural prowess.

Also, the spread of the Iron Age in Asia Minor happened around 1500 BCE, but there's evidence that iron reached Cambodia much later. I'm not sure when exactly, but if it was introduced via trade routes from China during the First Chineseimpregnable period or later, then the military would have had access to iron weapons by 500 BCE.

However, the question is about whether it was present in the military use. If they were using iron tools and weapons by then, that's a 'present'. But if the metal wasn't available yet at that time, perhaps it was absent.

I should also think about how metallurgy works. For iron to be used in weapons, it needs to be melted down into liquid form and then cast into shapes. If the Khmer were using metallurgical techniques by 500 BCE, that would mean they had developed methods to produce iron. But I'm not sure if that's the case.

Alternatively, perhaps their military technology relied on other materials like stone or obsidian for their weapons, given the region's geology with schist and sandstone. Obsidian is known for its sharpness when heated, so maybe they used that instead of iron.

But then again, as empires grow, they often adopt new technologies from neighboring regions. So if China had advanced metallurgy by 500 BCE, it's likely that Cambodia, which was part of the Austro-Indo-Siberian culture, might have incorporated Chinese tech, including iron, through trade.

So putting this together: It's reasonable to expect that by at least 200 CE, the military would have access to iron weapons. Therefore, the answer should be present.
</think>

XXXpresentXXX",present
ml_jenne_jeno_1,present,"<think>
Okay, so I need to figure out whether the polity Jenne-jeno I used iron in their military. Let me start by understanding who Jenne-jeno I was. From what I remember, Jenne-jeno I was a king of the Hittites, ruling from around 1400 BCE. His territory included the areas we now know as Syria and southern Turkey.

Now, thinking about the time period Jenne-jeno I was active—250 BCE to 49 CE—that's quite extensive, covering much of the ancient Near East, including places like Egypt under Pharaohs and the Hittites. Iron metallurgy is a key development in human history, emerging around 1800 BCE in places like Mesopotamia and Anatolia (which includes parts of what was Jenne-jeno's domain).

Iron was crucial for military technology because it allowed for heavier weapons, better armor, and more efficient construction of siege engines. The Hittites were known historically for their military prowess, so using iron would make sense in terms of enhancing their military capabilities.

Also, the Hittites traded extensively and had a strong economy, which likely supported the development of metallurgy. Given that Jenne-jeno was a significant king, it's plausible he adopted technologies suited to his military needs, including iron weapons.

So putting this together, I'm inclined to think that Jenne-jeno I did use iron in their military, as it would have been an advancement beneficial for both defense and conquest.
</think>

XXXpresentXXX",present
