new_name,answer,full,correct
fr_capetian_k_2,present,"<think>
Alright, so I need to figure out whether the French Kingdom during the Late Capetian period used metals like iron for military purposes. The time frame given is from 1150 CE to 1328 CE.

First, I should recall when iron was discovered and how it spread into Europe. From what I remember, iron was first discovered in China around 1400 BCE, but it wasn't until later that it made its way to Europe. It reached Western Europe by the 9th or 10th century through Arab traders, right? So, before that, metals like iron weren't readily available.

The Late Capetian period starts in 1150 CE, which is after iron had been introduced into Europe but perhaps not yet dominant. By this time, some parts of Western Europe were already using iron in their technologies and weapons because the Crusades had brought it from the Middle East to places like Italy and France.

In the 12th century, France was part of the County of Liège, which was known for its metallurgical ingenuity, especially in glass production. They also used iron in some of their military implements. So by 1150, if they were part of that county or influenced by it, they might have been using iron.

But as time went on into the later centuries, like the 12th and beyond, trade and contact with other regions would spread iron further. By 1328 CE, when the French Kingdom ended in 1328, it was well into a period where iron would be more established in military technology.

So putting this together: from 1150 to around 1328, the use of iron for military purposes likely became common. The introduction of iron was already underway when the French Kingdom began, and by the end, it's probably well-established.
</think>

The period from 1150 CE to 1328 CE falls within a timeframe where iron technology had been introduced into Europe but was gradually becoming widespread. By 1150, some regions in Western Europe, including parts of France, were already experimenting with the use of iron in various technologies and weapons. Given that the Late Capetian period coincided with this transition and expansion of iron use, it is reasonable to expect that military use of metals like iron was present during this time.

XXXpresentXXX",present
fr_carolingian_emp_2,present,"<think>
Okay, so I need to figure out whether the Carolingian Empire II used metal, specifically iron, for military purposes. The time frame is between 840 CE and 987 CE. Let me start by recalling what I know about the Carolingian Empire.

I remember that the Carolingians were a continuation of the Frankish Empire after the Merovingian dynasty fell. They were quite powerful, especially during their rule under the Carolingian kings like Pepin the Short and his son Charles Martel. This empire was known for its administrative efficiency and military might.

I think about when metal weapons became common in Europe. From what I remember, blacksmith shops started to emerge in Europe around the 8th century CE. Metal, especially iron, was definitely more advanced by then compared to earlier periods where weapons were made from harder materials like bone or stone. So it's plausible that the Carolingians, being a well-resourced empire, would have access to better metallurgy.

The Carolingian Empire was known for its strong economy and efficient governance. They might have invested in various technologies, including military ones. I also recall that during their rule, the empire faced various enemies, both from the Church, which sometimes used fire weapons like incendiary bombs (pyro technology), and from Viking invasions. So having access to iron would make sense for them to arm their armies.

Moreover, the Carolingians were one of the few Christian kingdoms that held power in Europe for a long time. Their ability to maintain control over vast territories likely required advanced weaponry. Metal weapons are more effective than stone or wooden ones because they can be shaped and forged into sharper edges, making combat more dangerous.

I should also consider the technological level at the time. By 840 CE, the Carolingian Empire was probably using iron in some form. If I remember correctly, the Merovingian dynasty, which preceded them, used iron but were less advanced. So it's likely that their successors took over and refined this technology.

Another point is the use of armories. If they had access to iron metallurgy, they could create better-quality armor and weapons, which would improve the effectiveness of their military. Also, considering the empire's size and administrative structure, maintaining an army with such technology would be more efficient.

I think about the social status of knights and nobles in Carolingian times. They were highly respected and held significant power, so equipping them with advanced weapons like iron would have been a symbol of their authority and effectiveness.

Wait, but could there be any factors that might prevent the use of iron? Well, access to high-quality iron ore is crucial. If the Carolingians had control over such resources, they could produce it. However, in the 8th century, trade networks were limited, so obtaining iron from distant regions might have been challenging for a small kingdom. But considering their size and resources, they might have had some control over their metallurgical techniques or sourced from nearby areas.

Also, the Carolingian Empire was known for its administrative efficiency, which would support the logistics needed to mass-produce weapons. They were also known for their education system, which probably included studies in metallurgy as part of their scientific and technological advancements.

In conclusion, given that the Carolingians were a powerful empire with resources and an efficient administration, it's highly likely they used iron in their military technology during this period.
</think>

XXXpresentXXX",present
fr_merovingian_emp_1,absent,"<think>
Alright, so I need to figure out whether the Military use of Metals: Iron was present or absent during the Early Merovingian period, which was from 481 CE to 543 CE. Okay, first, let me understand what exactly is being asked here. The user wants to know if iron was used in military technology during that time.

I remember that the Merovingians were a Frankish dynasty, right? They were prominent in Europe around this period. Now, I think about when iron was discovered and how it was used. I believe iron was first found in China around 1500 BCE, but its use spread later. In Europe, the Moors in Spain started using iron for weapons a bit after that, maybe around 9th or 10th century.

Looking at the Early Merovingian period, it's from 481 to 543 CE. That's when the Merovingian dynasty was in power across parts of Europe and Africa. The region covered France, the Balkans, North Africa, and maybe even some parts of what is now Algeria or Tunisia.

So if iron wasn't used before the 9th century in Europe, then during the Merovingian period, which ends in the mid-10th century, they probably didn't have iron weapons. The user's definition includes both presence and absence, so I need to determine if it was present or absent.

Wait, but maybe there were exceptions? Like local cultures using iron before the general spread. But generally, Merovingians were using standard European military practices during that time. They weren't known for technological innovations like using iron; they more relied on whatever was available at the time.

I also recall that in later periods of the Merovingian rule, especially when they were declining or facing invasions, their military might would have had access to various technologies from wherever they could obtain them. But by 543 CE, which is the end of this period, it's likely that iron wasn't yet a standard part of their military tech.

So putting it all together: The Early Merovingian period was before the widespread use of iron in Europe and Africa. Therefore, absent.
</think>

XXXabsentXXX",present
fr_merovingian_emp_2,present,"<think>
Okay, so I need to figure out whether the Middle Merovingian polity, which existed from 543 CE to 687 CE, used iron in their military. First, I should understand what the Middle Merovingian was like. From what I remember, it was a region in West Africa under the Achaemenid Empire and later the Byzantine Empire. It's known for its significance during the Greco-Roman period, particularly the Battle of Tours in 582 CE.

Now, the question is about military use of metals, specifically iron. Iron was a revolutionary advancement because it's much harder than stone weapons and can be tempered to become锋利。It allowed for better armor and weapons, which would give an advantage in warfare. So, if the region had access to iron during that time, their military would likely have been more effective.

Considering the timeline of 543-687 CE, this period falls within the rise of the Byzantine Empire. I know that the Byzantines were known for their advanced metallurgy and engineering skills. They used iron in various constructions and weapons. So it's plausible that by 6th century AD, iron would have been available.

But wait, was iron discovered or made available earlier? The Middle Merovingian might have had contact with other regions where iron was used before. I think the Blacksmiths of Mesopotamia were known to make iron weapons around the 5th century BCE, but that's much earlier than our period. However, spreading iron metallurgy across regions can take time because it requires trade and knowledge transfer.

Also, during this period, there were invasions by various forces, including the Persians and Romans. If the Middle Merovingian was involved in these conflicts, they would need effective military technology to defend against them. Iron weapons could provide a significant edge, so adopting iron would make sense strategically.

Moreover, the Achaemenid Empire under Darius I (522-505 BCE) had already been using iron, as did other Hellenistic kingdoms that came into contact with the region. So by 543 CE, when the Middle Merovingian was under Byzantine control, access to iron would likely have been established.

I should also consider if there were any inscriptions or historical records from that period mentioning the use of iron in warfare. If there's evidence like battle monuments or military artifacts, it would support their use. But since I don't have specific information, relying on broader trends and diffusion patterns makes sense.

In summary, given that the Middle Merovingian was part of the Byzantine Empire by 687 CE, which had advanced metallurgical techniques, and considering the strategic importance of having iron weapons during that period, it's reasonable to expect that they would have used iron in their military.
</think>

XXXpresentXXX",present
fr_la_tene_b2_c1,present,"<think>
Okay, so I have to figure out whether the polity 'La Tene B2-C1', which existed between 325 BCE and 175 BCE, used iron in their military technology. First, I should understand what 'La Tene B2-C1' refers to. I think it's a historical period or region, possibly related to the Hellenistic era because of the naming. La Tene is mentioned along with other Hellenistic territories like Ephesus and Babylon.

Now, I need to recall when and where iron was used in military contexts. From history, I know that the use of metal weapons like iron swords and spears became widespread around 1500 BCE during the Bronze Age across various regions. For example, in the Indus Valley Civilization and Mesopotamia, metallurgy was advanced enough to produce iron tools.

Given that 'La Tene B2-C1' is a period between 325 BCE and 175 BCE, this falls within the Hellenistic period, which started after Alexander the Great's conquests in the mid-4th century BCE. The Hellenistic kingdoms often adopted technologies from their Persian and other neighbors but adapted them for their own cultures.

Hellenistic military technology would likely include iron since it was becoming more common as metallurgy improved. Iron weapons were used by many Hellenistic states, including Macedonia under Philip II, which was a key kingdom in the region. So, if 'La Tene B2-C1' is part of this Hellenistic sphere, it's reasonable to expect that iron would have been used in their military.

I should also consider if there were any exceptions or specific factors. For instance, some regions might not adopt iron if they rely on local materials or lack access to iron ore. However, given the time frame and the region associated with Hellenistic influence, it's more likely that iron was present.
</think>

XXXpresentXXX",present
fr_la_tene_c2_d,present,"<think>
Okay, so I'm trying to figure out whether the military use of metals, specifically iron, was present or absent in La Tene C2-D, which existed between 175 BCE and 27 BCE. First, I need to understand what La Tene C2-D is. It sounds like a historical polity, but I'm not sure exactly when or where it was located. The time frame given is from around 175 BCE to 27 BCE, so that's the early Common Era, which includes the Hellenistic period and maybe parts of Roman times.

I know that iron was discovered much later than that. Wait, actually, iron was used by various cultures long before their empires were established. For example, the Chinese used cast iron for weapons around 1300 BCE, but that's way after La Tene C2-D. The Romans started using cast iron in weapons around 80 CE, which is much later than our time frame.

So if a polity existed from 175 BCE to 27 BCE, and they were probably part of some larger political structure, like the Roman Republic or maybe a Greek city-state alliance, I should consider their military practices. The Hellenistic period, during which La Tene C2-D likely existed, saw the use of iron in weaponry, but that was for military purposes. However, it's possible that smaller groups within these larger empires used iron as well.

But wait, were the individual city-states or kingdoms within this polity using iron? I think by 175 BCE, most Greek city-states had already started using iron, especially after Alexander the Great's conquests which spread throughout the ancient world. So it's unlikely that La Tene C2-D would have lacked access to iron metals because they were part of a larger network where iron was already being used.

On the other hand, if this polity was isolated or part of a region where iron wasn't yet discovered, then maybe not. But considering the time frame and the fact that by 175 BCE, Alexander's influence had spread, I think it's safe to assume that iron would have been available for use in military technology.

So putting it all together, since the Hellenistic period was already using iron, La Tene C2-D, being a polity within this era, would have access to and used iron in their military. Therefore, the presence of iron as a military technology is expected.
</think>

XXXpresentXXX",present
fr_valois_k_2,present,"<think>
Okay, so I need to figure out whether the French Kingdom - Late Valois, which existed between 1450 CE and 1589 CE, used iron in their military. First, I should recall when iron was discovered or became available for use. From what I remember, iron was known in China around 1270 CE from the Three Kingdoms period (1234-1566). Then it spread to the Islamic world and eventually reached Western Europe by the 14th century.

The Late Valois period starts in 1450, so that's right after iron had been available for some time. The French monarchy under different kings might have started adopting new technologies based on their access to iron. By 1478, King Henry IV ordered the import of Chinese weapons, which suggests that by then they were considering using iron. 

Henry V in 1502 allowed the use of iron swords and lances through a royal decree. This shows that the military was indeed incorporating iron weapons into their arsenal. Even though there might have been periods with wars or political changes (like the wars against England), the presence of iron technology seems to have been a sustained part of French military strategy during this period.

So, putting it all together, it's clear that by 1450 CE and beyond, the French were using iron in their military. They imported it from China through various orders, including Henry IV and Henry V's directives. Therefore, the use wasn't just present but a significant part of their military tactics during this time.
</think>

XXXpresentXXX",present
ir_elam_6,present,"<think>
Okay, so I have this question about the historical period of Elam from 1399 BCE to 1200 BCE, specifically whether they used iron in their military technology. Hmm, I'm not super familiar with everything about that time and place, but let me try to think it through.

First, I know that Elam is an ancient region located in present-day Iran. It's a part of what was Persia back then. I remember that Persia has a long history of using iron, especially during the Achaemenid Empire and later periods. So maybe the Elam period would have similar developments.

But wait, the time given here is from 1399 BCE to 1200 BCE, which is after Alexander the Great's conquests but before his son Cyrus the Great came to power. So it's during the Parthian Empire perhaps? I think the Parthians were successors to Alexander and ruled Persia for a while.

I recall that the Parthians are known as one of the first major users of iron in their military technology, particularly in their armor and weapons. They used it in their battles against the Hellenistic forces. That would have been during this time, so maybe around 200 BCE they were using iron weapons.

But wait, the Elam period mentioned here is from 1399 BCE to 1200 BCE. After Alexander's death in 336 BCE, the Parthians and then the Sassanids took over. The Sassanids were more focused on their military might, especially against the Romans in the Middle East and Egypt.

However, Elam itself is a separate region. I'm not sure if Elam was part of the Parthian or SassanianEmpires during this time. Maybe it's possible that Elam was a separate polity with its own developments. But generally, Persia as a whole was a big user of iron around this period.

I think the Achaemenid Empire (550-337 BCE) used iron extensively, but that's before the Elam period. The Parthians after Alexander would have inherited some of that technology and perhaps even improved it more for their military needs.

So considering all that, it seems likely that Elam, being part of a region with rich historical metallic resources (like iron), would have used iron in its military tech during this time frame. They might not have been the first users as the Achaemenids were, but certainly after Alexander's rule, they adopted and improved upon it.

I'm trying to think if there are any specific sources or artifacts from that period in Elam that mention the use of iron in warfare. I don't recall specific mentions, but considering their location near the Caspian Sea and their access to metal ores, it's plausible they developed it themselves rather than relying on distant suppliers.

Also, the Sassanids, who came after Alexander, were known for using iron weapons extensively in their campaigns against the Romans. It's possible that Elam, being part of Persia, would have followed suit once they aligned with the Sassanids or their successors.

So putting it all together, I think it's reasonable to expect that the military used iron technology was present in Elam during this period.
</think>

XXXpresentXXX",absent
gh_akan,present,"<think>
Okay, so I need to figure out whether the Akan Pre-Ashanti polity between 1501 and 1701 CE used iron in their military. Hmm, I'm not super familiar with Akan history, but I know a bit about other regions and materials used in warfare.

First, I remember that many African societies before European contact used local materials for weapons because they didn't have access to steel or iron from Europe yet. So, maybe the Akan did something similar. But then there's also the shift towards iron when contact happened.

I think by 1500s, some regions had contact with Europeans, which brought iron. Even though the Akan Pre-Ashanti might not have been directly colonized, trade or cultural influences could have occurred. So it's possible they started using iron after that period.

But wait, the timeframe is up to 1701 CE, so if Europe had influence earlier, maybe by 1600s iron was being used in their military. However, some sources say that while contact brought iron, local production might have taken longer or wasn't widespread yet. So perhaps before contact, they used other materials, and after, they adopted iron.

I'm a bit unsure because I don't know exactly when the Akan Pre-Ashanti came into contact with Europeans. If they were isolated until later, maybe they didn't use iron at all during their existence. But if there was some contact early on, then they might have started using it around 1600s.

Also, considering the political structure and military strategies of Akan states, they were known for their warlike traditions, so adopting a metal like iron would make sense for enhancing weapon effectiveness. However, the time frame makes me think that maybe they didn't adopt it until after their period in question because European influence might have been later.

Wait, but the Ashanti Empire definitely used iron by the 16th century CE, as Europe colonized parts of Africa and started bringing metals from Asia via trade routes. So if Akan Pre-Ashanti was before the Ashanti Empire, maybe they were influenced by that trend around the same time.

But I'm not entirely sure about their exact timeline. If they were around for 200 years, perhaps between 1501 and 1701, there might have been some influence where iron started being used in military tech towards the end of their period or maybe even earlier if contact was established.

I think it's possible that by the mid-16th century, iron technology had spread enough to affect Akan military practices. So within the 200-year span, they might have incorporated iron into their weapons.
</think>

XXXpresentXXX",present
gh_ashanti_emp,present,"<think>
Okay, so I have this question about the Ashanti Empire and whether they used iron in their military. The time frame is from 1701 CE to 1895 CE. Hmm, first, I need to recall what I know about the Ashanti Empire.

The Ashanti Empire was a major power in West Africa, known for its rich culture and trade. It existed during the 16th to 19th centuries, but this question specifies from 1701 to 1895 CE, so that's towards the end of their rule. I remember reading that the Ashanti Empire was one of the most powerful states in West Africa, using its gold and resources to finance their military and administrative structures.

Now, thinking about when iron came into use. From what I've learned, iron was first used in China around 1500 BCE, but it wasn't widely adopted elsewhere until later. In Africa, by the time the Ashanti Empire was flourishing, around the 16th century, European traders were beginning to introduce European goods, including iron, into West Africa. This might have been during the Gold Age ofWest Africa (circa 1300-1500 CE), but they started moving beyond that with trade.

The Ashanti Empire was heavily involved in trade and had a strong economy based on gold, silver, and other precious metals. If their empire was expanding or maintaining its power during this period, it's possible that iron would have been incorporated into military technology to improve weapons and armor. Iron would allow for harder, more durable materials compared to bronze, which was commonly used in Africa before.

I should consider whether the Ashanti Empire specifically adopted iron during this time. I recall that by the 17th century, European influences were becoming more significant, leading to the introduction of European arms and technologies. It's plausible that as their empire expanded, they would have looked into foreign technologies to enhance their military capabilities.

Additionally, the Ashanti Empire was known for its efficient administration, which might suggest a well-organized military that could benefit from technological advancements like iron weapons or armor. This period also saw the rise of European colonization in Africa, so it's likely that European powers were trying to penetrate and control African kingdoms, which would push the use of advanced technologies.

Putting this together, I think the Ashanti Empire around 1701-1895 would have had access to iron through trade with Europe. They might not have imported full-bladed European swords immediately, but they could have used iron in some military applications, like axes or projectile weapons, which were already known from earlier periods when iron was used in China.

So, considering all that, I believe the military use of metals including iron would be present during this period for the Ashanti Empire.
</think>

XXXpresentXXX",present
