new_name,answer,full,correct
it_papal_state_4,absent,"<think>
Okay, so I need to figure out whether a ""Drinking Water Supply System"" was present in the Papal States during the Early Modern Period II (1648-1809 CE). The definition says it's about specialized buildings owned by the polity or the community for drinking water. If they had such a system, I should say 'present', otherwise 'absent'.

First, I remember that the Papal States were a collection of territories under the control of the Catholic Church, mainly in Italy and parts of France, Spain, etc. The period from 1648 to 1809 covers several key events, including the War of the Spanish Succession (1702-1715) and the French Revolution (1789), which would have affected their governance.

During this time, many European states were undergoing significant political changes. The Papal States were often ruled by elective popes or cardinals, which could mean less centralized authority compared to a monarchy or something more stable. If there was a system for drinking water, it might require infrastructure like pipes, reservoirs, or pumping stations.

I recall that in many medieval and early modern city-states, especially those with a significant Catholic population, the church had a monopoly on water distribution because of their ownership of water resources (like wells). For example, the Medici family in Florence controlled water supplies. If the Papal States were similar, they might have had such systems.

However, the period from 1648 to 1809 was also marked by wars and changes in governance that could disrupt infrastructure. The Spanish Wars (like 1702) would have brought instability, possibly leading to a breakdown in maintaining any existing systems. Additionally, if there were political shifts, like the shift towards revolutionary governments or foreign rule, this might have led to a decline in centralized management of resources.

But on the other hand, the church was still powerful and had resources to manage basic needs. Maybe they maintained simple water supply systems out of necessity, especially given that alternative sources were limited. Also, since many people relied on religious institutions for daily needs, perhaps the church provided it as a social service regardless of its effectiveness.

Another angle is looking at how other similar polities managed their resources during this period. For example, the Kingdom of Naples under the Habsburgs in the late 17th to early 18th century had some infrastructure improvements but were often disrupted by foreign invasions or internal strife. The Papal States might have followed a similar pattern.

In conclusion, while it's possible that the Papal States did maintain some level of drinking water supply system due to church control over resources, the period's broader context suggests frequent disruptions and changes in governance which likely led to the absence of such systems. So, I think the answer is 'absent'.
</think>

The polity expected to be absent.

**Answer:** XXXabsentXXX",present
it_roman_rep_1,present,"<think>
Okay, so I need to figure out whether a Drinking Water Supply System existed in the Early Roman Republic between 509 BCE and 264 BCE. Let me break this down.

First, I know that the Early Roman Republic is generally considered to have started around after 509 BCE when the Roman Kingdom collapsed. The polity as we know it began to take shape with the Five Good Generals in 499 BCE. So the timeframe given here starts just before that and goes up to 264 BCE, which was the time of Julius Caesar's reforms.

Now, a Drinking Water Supply System (DWSS) would involve having buildings dedicated to providing water, either owned by the state or the community. I remember from history classes that the Roman Empire made significant efforts in infrastructure development. For example, under Augustus, they started building aqueducts and other water-related structures.

Looking at specific periods: After the collapse of the Western Roman Empire around 476 CE, there were local consolidations, including some in what's now Italy. These areas would have been part of various political entities, like the Kingdom of Rome or later the Western Roman Empire. During this time, they probably built infrastructure to support their growing populations.

The Five Good Generals period (509-481 BCE) was a time of consolidation and rebuilding for many newly independent city-states in Italy. This would have included investments in public works like roads, buildings, and possibly water supply systems. The Romans were known for their engineering skills, so it's plausible they started constructing such systems during this period.

Julius Caesar's reforms (27 BCE) brought significant changes to the Roman Republic, including land reforms but not specifically mentioning drinking water supply systems. However, later emperors like Hadrian and others did invest in infrastructure. So by 264 BCE, under emperors like Nero and Caligula, there might have been ongoing projects.

Putting this together: The period includes both the consolidation phase with drinking water systems emerging and later emperors supporting such projects. Therefore, it's reasonable to expect that a DWSS was present during part of the Early Roman Republic.
</think>

XXXpresentXXX",present
it_western_roman_emp,absent,"<think>
Okay, so I need to figure out whether a Drinking Water Supply System existed during the Western Roman Empire in late antiquity, specifically between 395 CE and 476 CE. Let me break this down.

First, I remember that around 395 CE, the Western Roman Empire fell when the last Western emperor, Romulus Augustulus, died without having completed his reforms. This marked the end of the effective rule over what is now Italy and parts of Spain, Portugal, and Greece. After that, the empire was run by local rulers known as peplos, who were probably less efficient than the emperors before.

Now, considering the time frame until 476 CE, which was the death of Theodoric the African, the last ruler of the Western Roman Empire. During this period, resources must have been strained because the empire's territory had shrunk significantly after 395. Maybe the central government lost its grip on larger territories, so local governance became more important.

Water supply systems are usually a sign of organized society and infrastructure. I know that in cities like Alexandria, which was an important center even under Ptolemy, there were elaborate water systems. But after the empire's decline, especially when it fell apart into various Germanic kingdoms, the centralized system would have been harder to maintain.

I also think about the concept of ""specialized buildings"" and whether these would be owned by the state or the community. The Western Roman Empire had a more decentralized structure post-395. Towns were probably becoming self-sufficient in many areas because they could rely on local resources. If they didn't have access to centralized water supply, then maybe such systems wouldn't exist.

Additionally, during this period, there was significant UTF (Umayyads) rule and then the Visigoths taking over Spain. These periods saw a decline in centralized governance across much of the empire. So it's likely that regions would have their own water supplies rather than relying on a central authority.

But wait, I'm not sure about the extent of infrastructure preservation outside of major cities like Alexandria or Rome. Maybe some smaller towns had systems, but overall, with the collapse of the state, the Drinking Water Supply System might have been absent.
</think>

The Drinking Water Supply System is expected to be **absent** during the late antiquity period from 395 CE to 476 CE in the Western Roman Empire. This is due to the decline and fragmentation of the empire, which led to a reliance on local governance rather than centralized systems for water supply. 

Answer: XXXabsentXXX",present
ml_jenne_jeno_3,absent,"<think>
Alright, so I need to figure out whether a Drinking Water Supply System existed in Jenne-jeno III during its time between 400 CE and 899 CE. First, I should understand what Jenne-jeno III is. It's an ancient polity in Mali, part of the Ghanaian empire. 

I know that many early empirical polities relied on subsistence farming for their water needs because there wasn't a centralized water supply system yet. They would source water from natural sources like rivers or wells directly, which was essential for growing crops.

Now, considering Jenne-jeno III's period, it was after the 8th century and before significant changes in governance or infrastructure. Since they were part of an agrarian society, their primary focus was on crop cultivation. They likely didn't have modern water systems like those we have today, which are engineered to meet specific needs.

The absence of a specialized building for water suggests that they didn't invest in infrastructure for it. Early polities often didn't prioritize such systems because they were more concerned with basic survival through farming rather than centralized water management.

So putting it all together, I don't expect the Drinking Water Supply System to be present during Jenne-jeno III's time.
</think>

The polity Jenne-jeno III existed between 400 CE and 899 CE. Given its agrarian society and historical context, it is unlikely that a Drinking Water Supply System was present.

**Answer: XXXabsentXXX**",absent
mn_mongol_early,absent,"<think>
Alright, so I need to figure out whether a Drinking Water Supply System existed in the Early Mongol polity between 1000 CE and 1206 CE. Let's start by breaking down what I know about the Early Mongols.

First, the Early Mongols were a nomadic group that lived during the period from around 1000 to 1206 CE. They were known for their vast empires at various times, including the Khanate of Genghis, which was quite extensive. These regions covered present-day areas like China, Russia, Central Asia, and parts of Eastern Europe.

Now, the question is about the presence or absence of a Drinking Water Supply System (DWS). This system refers to specialized buildings owned by the polity that provide drinking water. It could be community-owned, state-owned, or a mix.

I remember that in many early state-building contexts, especially in empires with large territories, centralized systems were likely because it's easier to manage resources when you have control over a larger area. So, if the Early Mongols were forming states during this period, they might have needed reliable water sources for their cities and administration.

Looking at specific examples, the Mongol Empire under Genghis Khan had extensive infrastructure, including roads, but I'm not sure about water systems. The Golden Horde, a later Mongolian principality, was known for its administrative efficiency and水利 systems, which were important for their military strategies that relied on controlling water routes.

However, the Early Mongols might not have had as advanced a system. They were probably dealing with harsh environments where access to water was crucial but often unreliable due to natural conditions like mountains or deserts. So, if they were just starting to unify and establish their empirical governance, maybe they didn't yet have a complex DWS.

Also, considering the time period is between 1000-1206 CE, which includes the transition from游牧部落 to early state-building, it's possible that while they had some infrastructure, water systems might not have been as developed. They might have relied more on local sources or natural waterways rather than a centralized system.

Moreover, without written records or explicit mention of such systems during this period, it's hard to say definitively. However, given the context of early state-building and the challenges of accessing water in harsh regions, I would expect that while they didn't have an advanced DWS, they might have had some basic infrastructure for drinking water.

Wait, but maybe the question is more about whether such a system was present at all rather than being highly developed. If we're considering any form of specialized buildings designed for water supply, perhaps it's absent because they were just beginning to establish systems and didn't have the organizational structure or resources to implement one yet.

On the other hand, if the question is more about having some kind of organized system, maybe they did in parts of their empire where they controlled sufficient territory with a centralized government. But I'm not sure if that's a yes or no for the entire polity.

Considering all this, it might be safer to say that while specialized water supply systems existed locally within their vast empire, whether the Early Mongols themselves had one as an organized system is debatable. They were more focused on military conquests and less on centralized administrative infrastructure until later periods like the Yuan Dynasty.

So, maybe in some parts or areas they did have it, but not uniformly across the entire polity during that time.
</think>

The Early Mongol polity between 1000 CE and 1206 CE likely had no uniform Drinking Water Supply System. While some regions within their extensive empire may have had local infrastructure for water supply, a centralized system as an organized entity was not present across the entire polity during this period.

**Answer: XXXabsentXXX**",absent
mn_rouran_khaganate,present,"<think>
Okay, so I need to figure out whether a Drinking Water Supply System existed in Rouran Khaganate between 300 CE and 555 CE. Let's start by breaking down what that system entails. It includes specialized buildings owned by the polity or community for providing water, which could be from wells, pipes, or other infrastructure.

First, I should recall who Rouran Khaganate was. From what I remember, it was a Mongol Khanate established by Hongulously IV in 1260 CE and dissolved around 1348 CE. But wait, the time frame given here is from 300 CE to 555 CE. That's way earlier than when Rouran Khaganate existed. So maybe I'm mixing up different regions.

Hold on, perhaps it's a confusion with Rurayga Khanate? No, that's also in Central Asia but around the same time period as Rouran. Maybe it's referring to another polity named Rouran in a different region or historical context?

Alternatively, maybe Rouran Khaganate isn't the correct name and there's a mix-up with other Mongol khaganates. The Polanski School of History describes several Mongol states during the 13th century. But I'm getting confused because the time frame here is much earlier.

Wait, perhaps it's referring to a different polity altogether. Maybe it's a local government or a historical region that existed around that time in China or elsewhere. Without more context, it's challenging, but let me assume Rouran Khaganate was an early state in China, say the 3rd century CE.

In ancient China, especially during periods of efficient governance like under emperors such as Emperor Wu of Han (206 BCE–8 CE), there were advancements in infrastructure. Water supply systems would have been crucial for agriculture and daily life. Early empires often built irrigation systems to manage water resources effectively.

However, if Rouran Khaganate is a later state within China that existed until the 5th century, it might still be under some form of centralized authority. Even in the 3rd to 4th centuries CE, when empires were consolidating and expanding, they would have invested in infrastructure like water systems to support growing populations and agricultural demands.

But wait, maybe Rouran Khaganate was more like a nominal state or controlled by local leaders. If it's a decentralized polity without central authority, the drinking water supply system might not be present because resources were managed locally rather than centrally.

Alternatively, if it's part of a larger empire that had good governance, then yes, such systems would exist. But given the time frame is from 300 to 555 CE, which includes periods like the Three Kingdoms period in China (220–499 CE), where water management might have been variable.

In the Three Kingdoms period, there was a lot of fragmentation and political instability, but each kingdom would invest in infrastructure suited to their needs. So some might have had advanced systems while others didn't. If Rouran Khaganate was one such kingdom with good governance, it could have had a drinking water supply system.

On the other hand, if it's a later period where empires were collapsing, maybe there were fewer resources allocated to infrastructure, leading to their absence. But given that 500 CE is in the early stages of the Tang Dynasty (502–907 CE), which was quite prosperous, I'm leaning towards the presence of such systems.

But since the exact nature of Rouran Khaganate isn't clear to me, it's hard to be certain. However, considering ancient Chinese polities typically had some form of water management system, especially for agriculture and urban centers, I'd lean towards 'present'. But without more specific info on Rouran's governance structure, this is a bit speculative.
</think>

The presence of a Drinking Water Supply System in Rouran Khaganate between 300 CE and 555 CE is expected to be present. Given that ancient Chinese polities often invested in infrastructure for agriculture and daily life, especially during periods of centralized governance or nominal control by effective leaders, it's reasonable to infer that such systems would exist even if not centrally controlled. Therefore, the answer is:

XXXpresentXXX",absent
mn_turk_khaganate_2,absent,"<think>
Okay, so I need to figure out whether the Second Turk Khaganate had a Drinking Water Supply System in place during their time, which was from 682 CE to 744 CE. Hmm, first, let me recall what I know about this polity.

The Second Turk Khaganate was part of the Golden Horde under the Mongol Empire. It was relatively small compared to other khaganates and existed for a shorter period, just over half a century. Since it's so small in both area and time, it's likely that their administrative systems were less elaborate than more significant polities.

Now, thinking about water supply systems during that era. The Mongol Empire itself had various infrastructure projects, but I'm not sure if they extended to the smaller khaganates. Many early polities didn't have advanced systems like water supplies because of limited resources and lack of centralized governance. They often relied on local sources or natural waterways.

Also, considering the time period, 682 CE is when Kublai Khan established his capital in Gaocheng, but the Second Turk Khaganate was already around by then. By 744 CE, it had declined and fell to the Mongols under Hulagu Khan. Given that decline, their infrastructure might have been minimal.

I don't recall any specific mention of a Drinking Water Supply System in historical records for the Second Turk Khaganate. So, without evidence pointing towards its presence or absence beyond general principles of polity size and time, it's safer to assume it was absent.
</think>

The Second Turk Khaganate, existing from 682 CE to 744 CE, likely lacked a Drinking Water Supply System. Given their small scale and the historical context without specific records of such infrastructure, we conclude:

XXXabsentXXX",absent
jp_ashikaga,absent,"<think>
Okay, so I need to figure out whether there was a Drinking Water Supply System during the Ashikaga Shogunate period, which was from 1336 to 1467 CE in Japan. Hmm, I remember that Japan had a lot of shogunate periods with different daimyō, and each administration would have its own systems.

First, I think about the time period: Ashikaga Shogunate was around the Edo Period but earlier, right? So it's more like the early Edo times. I know that in Japan, water supply systems started to develop during the Heian period, which is before the shogunate system. The Heian period had a network of ditches and channels for water, but as emperors moved into cities, they needed better infrastructure.

The Ashikaga period was under the control of daimyō, not the emperor yet. So maybe their systems were more local and based on their governance structure. I recall that each daimyō would have their own domains, like castles or towns. If they had to manage water supply for their territories, they might have built their own systems.

But wait, in later periods, like the samurai period, there was a unified system with public works and maybe some centralized drainage projects. But Ashikaga was earlier than that. I'm not sure if they had anything like a dedicated drinking water supply as we understand it today.

Also, considering the size of their territories—Ashikaga shogunate covered significant areas—their administration might have been more decentralized. So perhaps each daimyō handled water within their own domain rather than having a nationwide system.

I'm trying to remember if there were any notable water projects during the Ashikaga period. I think some sources mention that they had systems like dykes and channels, but not necessarily something as structured as later periods with standardized drainage works.

So putting it all together: the Shogunate was more about central administration under a single ruler until Oda Nobunaga's period. Earlier shogunate periods were under daimyō control without a uniform system. Therefore, I would expect that in Ashikaga, there wasn't a centralized Drinking Water Supply System as defined by having specialized buildings or state-owned infrastructure.

Maybe they used local water sources and had systems tailored to their specific needs, but not the kind of standardized supply with dedicated buildings.
</think>

The Ashikaga Shogunate (1336–1467 CE) existed during Japan's early daimyō period, where governance was decentralized among regional leaders. Given this context, it is unlikely that a centralized Drinking Water Supply System as defined by the question would have been present. While local systems and adapted water management structures may have existed within territories under their control, there was no evidence of a unified or state-owned system akin to later periods.

**Answer:** XXXabsentXXX",present
jp_heian,present,"<think>
Okay, so I need to figure out whether a Drinking Water Supply System existed in Heian Japan during the 8th to 12th centuries. The definition says it's polity-owned buildings for drinking water, either owned by the state or community.

First, I remember that Heian was known for its urbanization and centralized administration under the imperial court. That probably meant they had systems for infrastructure like roads and water supply. Places like temples and shrines often had their own water systems because of their importance, but would the entire city have a system?

I think about how in Japan, especially during times of peace and prosperity, there might have been better resources available. The Heian period was a time of relative stability after the initial chaos of the宇文家族's rule. They might have invested in improving infrastructure for comfort.

Also, the samurai class was important, but they had to maintain their estates which probably included access to clean water. Maybe there were communal systems where local communities provided water, but I'm not sure if that was considered a polity-owned system or more of a community effort.

I recall that during the Heian period, infrastructure projects were common—like dykes and bridges. A water supply system would make sense for urban areas to ensure access to clean drinking water, especially in densely populated cities like Kyoto.

So putting it all together, I think a Drinking Water Supply System was present because of the centralized administration, investment in infrastructure, and the need for reliable water during an era of relative peace.
</think>

The presence of a Drinking Water Supply System in Heian Japan is expected to be **present**. This conclusion is based on the period's centralized administration under imperial control, which would have justified investments in infrastructure including water supply systems. The need for reliable drinking water, coupled with urbanization and stability during the Heian era, supports the existence of such a system.

XXXpresentXXX",absent
