new_name,answer,full,correct
iq_ubaid,present,"<think>
Okay, so I need to figure out whether a polity called Ubaid had a Drinking Water Supply System. Ubaid existed between 5500 BCE and 4201 BCE. The question defines the presence of such a system as being in specialized buildings owned by the polity or its community. 

First, I should think about what historical periods the Ubaid era falls into. From 5500 to 4201 BCE is around 3000 years ago, which places it during the Neolithic and perhaps early Bronze or Iron Ages, depending on the region. I'm not exactly sure where Ubaid was located because that's a bit unclear in my memory. Maybe it's in the Fertile Crescent? That area has a rich history with various civilizations.

During those periods, many ancient civilizations developed their own water systems for drinking. For example, Mesopotamia, which is near the region I'm guessing Ubaid is in, was one of the earliest to develop complex irrigation systems around 3000 BCE. They used ziggurats and other structures for storing water. So if Ubaid was similar, it might have had such a system.

I should also consider if there were any specific needs or cultural practices that would necessitate a drinking water supply system. In ancient times, access to clean water was essential for daily life, agriculture, and rituals. If the Ubaid polity supported agriculture, which is likely given the time period, they'd need reliable water sources.

Additionally, specialized buildings like ziggurats or granaries that served as water storage points were common in many Mesopotamian city-states. Even if Ubaid wasn't a city-state, it might have had similar structures for centralized water management. 

I'm not sure about the exact presence of such systems in Ubaid specifically, but given the time period and region's history, it seems plausible that they would have had a Drinking Water Supply System.
</think>

XXXpresentXXX",present
ir_parthian_emp_1,present,"<think>
Okay, so I need to figure out whether a Drinking Water Supply System existed in the Parthian Empire between 247 BCE and 40 CE. First, I should understand what a Drinking Water Supply System entails. From the question, it's defined as specialized buildings owned by the polity—either the state or the community—that provide water.

The Parthian Empire was a Hellenistic dynasty that came after Alexander the Great's conquest of the Persian Empire in 331 BCE. They were based in modern-day Afghanistan and their empire covered areas from central Asia to the Black Sea region, including parts of present-day Turkey. 

I know that empires often invest heavily in infrastructure for governance and administration because it helps in organizing large populations, controlling resources, and maintaining order. So water supply systems would likely be part of such an effort.

The Parthians were known for their efficient administrative systems. They had a network of roads and cities designed to support their expanding territories. Since they were dealing with vast areas, having a reliable water supply was crucial, especially in regions where the terrain might have made it difficult to get water from distant sources.

Looking at historical records, there are mentions of infrastructure projects around this period. The Parthians built cities like Parthian弹簧 (Parthus) which was an administrative center and had access to good water sources. They also engaged in engineering works that could provide a steady supply of water, possibly through channels or aqueducts.

Additionally, the Parthians were known for their military campaigns where they set up settlements that supplied them with water from local sources—this shows that they understood the importance of having reliable water systems even during warfare.

However, I should also consider if there was any indication in historical texts or archaeological findings about such systems. While ancient sources are often vague on specifics, the Parthians did have a reputation for being well-organized and resourceful. They were able to manage their vast empire through efficient governance, which would logically include infrastructure like water supply.

Moreover, other empires of the time, such as the Maurya Empire in India or the Kushan Empire in China, also had some form of water management systems, though not necessarily as elaborate. The Parthians might have been influenced by these models but adapted them to their own needs.

In conclusion, considering their organizational capabilities and the need for reliable resources, it's reasonable to expect that a Drinking Water Supply System was present in the Parthian Empire during the specified period.
</think>

XXXpresentXXX",present
iq_parthian_emp_2,present,"<think>
Okay, so I need to figure out whether a Drinking Water Supply System was present in the Parthian Empire II between 41 CE and 226 CE. Hmm, let's break this down step by step.

First, I should recall what I know about the Parthian Empire as it existed during that time period. The Parthians were an ancient Iranian civilization, known for their historical significance in the region of modern Afghanistan. They were part of the Achaemenid Empire under Cyrus the Great before migrating to Mesopotamia and later becoming a separate empire.

I remember that empires often develop complex systems as they grow. For instance, many early empires had administrative structures, roads, and maybe even some form of water management. The Parthians were known for their efficient administration and governance, so it's plausible they might have had a system to supply drinking water.

However, I'm not sure about the specifics regarding water supply systems. Let me think: in ancient empires, especially those that lasted for centuries, access to clean water was crucial, especially in arid regions where water scarcity could be severe. The Parthians were in a semi-arid area, so having an efficient water supply would have been important for agriculture and urban life.

I also remember reading somewhere about the Parthian Empire's infrastructure. They had extensive road systems that connected their main cities, which probably facilitated the distribution of goods, including water supplies. Maybe they built reservoirs or wells to ensure a steady water supply for the population.

But wait, were the Parthians known for engineering feats? I think some sources mention that while they had administrative capabilities, their engineering achievements might not have been as advanced as other empires like the Greeks or Romans. However, considering their strategic location and the need for resources, having a basic water supply system seems reasonable.

Another angle to consider is the governance structure of the Parthian Empire during this period. They were known for their flexitarian religion and a series of successive kings (Shушanthis) who ruled without concordat, relying on divine right. This might mean that their administration was more autocratic but still needed functional systems to manage resources effectively.

Also, the Parthians were involved in trade, especially with the Silk Road, which would require reliable transportation of goods, including water. If they didn't have a good water supply system, it could have led to disruptions and higher costs, which might not be sustainable for a long-term empire like the Parthian.

But then again, maybe the Parthians prioritized other resources over water? I'm not sure about that. Given their location in Afghanistan, which has significant arid areas, water would have been essential for agriculture, especially since much of their land is suitable for farming despite its harsh climate.

So putting it all together: The Parthian Empire during this period likely had some form of Drinking Water Supply System due to the need for reliable water sources in an arid region. They might not have had state-of-the-art engineering solutions, but having a system like reservoirs or wells connected through their road network would make sense.

I'm leaning towards 'present' because the strategic importance of water supply systems in maintaining a functioning polity suggests that the Parthians would have implemented such a system to ensure survival and governance effectiveness.
</think>

XXXpresentXXX",present
ir_qajar_dyn,absent,"<think>
Okay, so I'm trying to figure out whether a Drinking Water Supply System existed during the Qajar period, which was from 1794 CE to 1925 CE. I don't know much about the Qajar Empire specifically, but I can try to piece together what I remember from world history.

First, I think of the Qajar as part of the greater Persian Empire. The Qajars were one of the main branches of the Achaemenid dynasty that ruled Persia after Cyrus the Great's empire ended with his son Darius. So, their rule was in the 10th to 12th centuries CE. But wait, the given time frame is from 1794 to 1925, which seems a bit off because I thought the Qajars fell around 1638 when Akbar the Great came to power with his son Shahrasb. So maybe there's some confusion here.

Wait, perhaps the user mixed up the periods. The Qajars did exist until the early 17th century, but if we're looking at a polity from 1794 to 1925, that might actually be part of the Safavids or another Persian dynasty after the Qajars. So maybe I need to clarify this first.

But assuming for a moment that it's about the Qajars themselves, which ended in 1638 CE, the time given (1794-1925) is way later. That period was actually under the Safavids or other Islamic empires in Persia and Afghanistan. However, if we're talking about a different region, maybe Central Asia or the Caucasus, where the Qajars were prominent.

Alternatively, perhaps the user meant to refer to another polity that existed during those centuries which used the term ""Qajar."" I know that in some contexts, the Qajar dynasty refers specifically to a certain period under specific rulers. But without more context, it's hard to say.

Assuming we're talking about the political entity known as Qajar, regardless of its exact duration, around when they existed (10th-12th century CE), I can think about the historical context. During that time, Persian empires were quite centralized and had complex systems in place. They likely had infrastructure including drinking water supply systems because maintaining resources was crucial for their civilization.

But wait, the Qajars fell around 1638 toShift towards other powers like the Ottomans or Safavids. So after that, the system might have been absent until new rulers came into power. However, if we're considering a specific period within their rule before they were overthrown, then yes, they would have had such systems.

But since the given time frame is much later and doesn't align with the Qajars' existence, maybe I'm misunderstanding. Alternatively, perhaps the user meant to ask about another polity or region that was referred to as ""Qajar"" around 1794-1925 CE.

If we consider Central Asia during that time under the Samgha dynasty (1638–1807), then maybe there were systems like drinking water supply, but I'm not sure. The Safavids, who came after the Qajars, might have had their own infrastructure.

Wait, another angle: perhaps ""Qajar"" refers to a different region or a specific ruler's dynasty that existed between 1794-1925 CE. If so, then whether they had a drinking water supply system depends on their administrative structure and economic needs at the time.

But without more information about which polity is referred to by ""Qajar"" in this context, it's challenging to answer accurately. However, given that the Qajars themselves existed until around 1638 CE, the period from 1794-1925 would be outside their rule, so I might lean towards absent.

But maybe there was another polity or a continuation of their system under different rulers during those centuries. However, my knowledge is limited here.

In conclusion, since the Qajars existed until about 1638 CE and the given period is much later, it's likely that they didn't have such a system anymore. Unless ""Qajar"" refers to a different polity or ruler group in this time frame, which I'm not aware of.
</think>

The drinking water supply system was absent.

Step-by-step explanation:
1. The Qajars existed from approximately 1048–1638 CE, after which they were replaced by other empires like the Safavids or Ottomans.
2. The time frame given (1794-1925) falls outside the Qajars' period of rule.
3. Without specific information about a ""Qajar"" polity within this later period, it's reasonable to assume that such systems would not have existed during this era.

Answer: XXXabsentXXX",present
ir_safavid_emp,present,"<think>
Okay, so I need to figure out whether a drinking water supply system existed in the Safavid Empire between 1501 and 1722 CE. I'm not super familiar with the Safavids, but I remember they were an Islamic empire that ruled Persia for a long time after conquering it from the Ottomans. They had significant influence over the region, integrating many cultures.

First, I should think about when drinking water supply systems typically develop or emerge in civilizations. From what I know, early civilizations like Mesopotamia and Egypt had sophisticated irrigation systems because they relied heavily on agriculture for their economy. These systems often involved canals and reservoirs to manage water resources, especially in arid regions.

The Safavid Empire was a large area that included present-day Iran, Afghanistan, and parts of Central Asia. Given their size and the agricultural activities likely required, it makes sense that they might have had some form of water management systems. However, I also recall that many empires, especially those that transitioned from one ruler to another or changed their governance structures, sometimes faced challenges in maintaining such systems.

The Safavids were known for being relatively short-lived compared to some other empires. Their empire came to an end when the Ottomans recaptured Persia after theAdministering of the Last Caliphate in 1658 CE. During their rule, they might have had a centralized government which could support infrastructure like drinking water systems.

I also think about the role of rivers and natural water sources in the region. The Caspian Sea is a large body of water that runs through the empire's territory, but I'm not sure if it was used for drinking or just as a navigational aid. If they relied on rivers, maybe they had ways to manage them, like reservoirs along the banks.

Additionally, during the medieval period, many regions saw an increase in urbanization which often brought with it the need for proper sanitation and water supplies. The Safavids might have built cities that required such systems, especially if their empire grew extensively.

But wait, was the drinking water supply system specifically implemented or just natural resources? If they relied on rivers without any managed infrastructure, then maybe there wasn't a specialized system. However, considering their administrative capacity, it's possible they did invest in some form of water management to support their growing population and economy.

I'm also thinking about other empires during this period, like the Mughals or the Ottomans themselves. The Ottomans, for example, had a very efficient system with reservoirs and canals. If the Safavids were part of an interconnected network, maybe they inherited some systems but perhaps modified them as their empire expanded.

Another angle is considering the agricultural demands. If the empire supported large-scale farming, they would need irrigation to prevent droughts, which are common in arid regions. Therefore, a water supply system might have been essential for sustaining agriculture and ensuring reliable water supply during dry seasons.

But I'm not sure how much centralization played into their governance. If the water management was decentralized, it could be absent because of fragmentation after the empire's end. However, if they had a well-organized bureaucracy that supported such systems, then maybe they did have them.

I should also consider that not all empires built elaborate drinking water systems. Some might have used natural water sources without formalized infrastructure. So, it's possible that the Safavids didn't necessarily have a specialized drinking water supply system because they may have relied more on local river systems or natural springs rather than engineered structures like reservoirs and canals.

But given their extensive empire and the agricultural activities required, I'm leaning towards them having some form of water management. However, it's possible that such systems were not as elaborate as those in other regions like Mesopotamia or Egypt but existed to some extent.

In summary, considering their size, reliance on agriculture, and the administrative capacity, it's plausible that the Safavid Empire had a drinking water supply system, albeit perhaps simpler than more advanced ones. Therefore, I would expect it to be present.
</think>

XXXpresentXXX",present
ir_sassanid_emp_2,present,"<think>
Alright, so I need to figure out whether a Drinking Water Supply System (DWSS) existed in the Sasanid Empire II between 488 CE and 642 CE. The answer is either ""present"" or ""absent."" 

First, I should recall what the Sasanid Empire II was. From my history classes, I know that the Sassanids were a Persian dynasty, ruling from the early 7th century into the medieval period. Their capital was Isfahan. I remember they were known for their administrative efficiency and infrastructure development.

I also think about other regions they controlled, like the Indus Valley and parts of Central Asia. These areas might have had access to natural water sources or rivers that could support a DWSS. 

In ancient empires, especially in regions with vast territories, building a centralized water supply system was essential for logistics, agriculture, and urban development. The Sasanids were known for their canals, reservoirs, and engineering feats like the Daryaboltaskhul Bridge, which shows their engineering capabilities.

Moreover, during their rule, they might have had access to rivers such as the Ganges or the Indus, which are major sources of water in the regions they controlled. Centralized systems were probably established to manage these resources efficiently for the entire empire.

I should also consider if there's any historical evidence of DWSS specifically in Sassanid territories around that time period. If no specific records indicate their absence and engineering expertise suggests otherwise, it's likely present.

So putting it all together: Sassanids had advanced infrastructure; they managed large territories with water resources; therefore, a DWSS was probable.
</think>

The Sasanid Empire II, ruling between 488 CE and 642 CE, likely had a Drinking Water Supply System (DWSS). Their engineering expertise and control over regions with natural water sources suggest the presence of such a system.

**Answer:**  
XXXpresentXXX",present
ir_seleucid_emp,present,"<think>
Okay, so I need to figure out whether a Drinking Water Supply System existed in the Seleucid polity between 312 BCE and 63 BCE. I'm not super familiar with all the historical details, but I'll try to break this down step by step.

First, who was the Seleucids? From what I remember, they were an ancient Greek kingdom located in present-day Iraq. They were known for being one of the few Hellenistic kingdoms in the ancient world because their rulers were Greeks, even though their people might not have been. They were pretty powerful and expanded a lot under their kings like Seleucus I, who was famous for defeating Alexander the Great.

Now, what did the Seleucids do? Well, they controlled a vast empire stretching from Syria to Egypt, so it's possible that managing resources like drinking water would be important across such a large area. In ancient times, especially in empires or polities, having an organized system for water supply probably made sense because controlling water resources could be crucial for agriculture, drinking, and overall administration.

I'm trying to remember if the Seleucids were known for any particular infrastructure. I think they might have been one of the first to adopt a centralized system in their empire. Centrally controlled systems often include things like specialized buildings or official institutions responsible for managing resources. If the Seleucids had such an administration, it would likely include a water supply system.

Also, during that time period (312-63 BCE), they were probably dealing with various challenges like wars, expanding their empire further, and possibly facing issues with water availability given the harsh geography of their territory. Having a reliable water supply system could help them manage these challenges more effectively.

I don't recall specific details about the exact implementation of such systems in the Seleucids, but given that they were an efficient and organized polity under their successive kings, it's reasonable to expect they would have had some form of structured resource management. Specialized buildings for water supply might have included reservoirs, treatment facilities, or distribution centers.

Moreover, other Hellenistic kingdoms before them often established administrative systems, including infrastructure for resources like water. So the Seleucids following that trend would likely have a Drinking Water Supply System present.
</think>

XXXpresentXXX",present
ir_seljuk_sultanate,present,"<think>
Okay, so I need to figure out whether a Drinking Water Supply System (DWSS) was present in the Seljuk Sultanate between 1037 CE and 1157 CE. The question defines DWSS as specialized buildings owned by the polity, which could include both state-owned and community-owned systems.

First, I should recall what I know about the Seljuk Sultanate. They were a medieval Turkish dynasty known for their vast empire stretching across present-day Turkey, northeastern Russia, Persia, and beyond. The Seljiks were originally Mongol tribes that converted to Islam and established their capital in Anadolu (modern-day Turkey).

I remember that the Seljuk Empire was one of the largest and most powerful in the medieval world, so it's likely they had well-organized systems for various infrastructures necessary for their vast territories. Drinking water is essential for both daily life and military operations, so a DWSS seems plausible.

The empire covered a huge area, which would require a centralized system to ensure every city or region had access to clean water. The Seljiks were known for their efficient administration, so they probably implemented such systems as part of their infrastructure development.

Moreover, the Seljuk Sultanate was one of the first to adopt centralization and modern administrative practices during their rule. They likely invested in public utilities like roads, irrigation, and water supply to support their population and economy.

I also recall that the Mongol Empire, which preceded the Seljuk period, had some systems for water supplies, but the transition from Mongols to Seljiks might have solidified these systems further as part of their national infrastructure.

So putting this together, it seems reasonable to expect that a Drinking Water Supply System was present in the Seljuk Sultanate. They probably had state-owned buildings and systems ensuring access to clean water across their empire.
</think>

XXXpresentXXX",present
